title,subreddit,created,num_comments
Sebastian Vettel stops 2015 celebrations to get Kimi Raikkonen's name added to pitboard 👏🏻,formula1,1536844103.0,200
Who is responsible for this...,gaming,1536820568.0,495
Saw this gem on my hometowns Facebook group.,oldpeoplefacebook,1536834620.0,209
Anon makes fun of Redditors,greentext,1536861984.0,196
WCGW if I overtake this biker while talking on the phone?,Whatcouldgowrong,1536823058.0,983
"This guy: Someone I ""love"" tried to commit suicide but let's make it all about me.",insanepeoplefacebook,1536827428.0,458
"TIFU by drilling my 6 year old in the face, Hail Mary style.",tifu,1536860314.0,156
"Roses are red, it’s hot like hell",boottoobig,1536862698.0,92
"TIFU by drilling my 6 year old in the face, Hail Mary style.",tifu,1536860314.0,156
"This guy: Someone I ""love"" tried to commit suicide but let's make it all about me.",insanepeoplefacebook,1536827428.0,459
My sad github repo.,ProgrammerHumor,1536849487.0,180
All in one gatekeeping,gatekeeping,1536856664.0,106
"People shown photos of politicians they're not familiar with can make better-than-chance judgments about whether those politicians have been convicted of corruption, even without knowing anything about the politicians or their careers, with a link to wider faces, finds a new Caltech study (N = 325).",science,1536821391.0,462
Or you could just Google it.,iamverysmart,1536843486.0,157
Usain Bolt races in artificially induced zero/very low gravity.,BeAmazed,1536819884.0,710
"My humanities teacher claims that in prehistory, human society was generally matriarchal, being ruled by priestesses, and that the main religion was mother-earth worship. She claims that this information is being passively covered up by acedemia. Would you consider this accurate?",AskHistorians,1536835580.0,68
"Sob stories, army, screenshots and TV shows, everybody!",quityourbullshit,1536837447.0,404
But Fr tho 😩,BlackPeopleTwitter,1536853470.0,138
I compared 100 years of hurricane paths vs. Georgia animated by /u/Tjukanov [OC]-ish,dataisbeautiful,1536831013.0,512
This Axel Voss guy celebrated when Article 13 was passed. Let's make a meme out of him so he gets banned.,PewdiepieSubmissions,1536856892.0,114
Naomi Osaka is reportedly set to sign Adidas' biggest deal with a female athlete — and it could make her one of the highest-paid women in sports,sports,1536809196.0,2829
Reddît Bans Qanon Subreddits After Series of Violent Threats,news,1536823884.0,3342
Poland says it will block any EU sanctions against Hungary,europe,1536850128.0,1143
hmmm,hmmm,1536826152.0,277
"Apartment maintenance man saw me in a state of undress, put his finger in my mouth.",legaladvice,1536822507.0,330
"TIL of Audie Murphy who was awarded every military combat award for valor available from the U.S. Army, as well as French and Belgian awards for heroism.",todayilearned,1536827322.0,1335
Thief prank,nonononoyes,1536828737.0,213
The wrath of the stoner art student,ProRevenge,1536854036.0,78
Why walk when you can _____?,AskOuija,1536835011.0,208
"First image from James Gray's sci-fi epic ""Ad Astra"" staring Brad Pitt and Tommy Lee Jones",movies,1536831159.0,624
Reddit bans QAnon subreddit,technology,1536812554.0,2513
Jokeception,WhitePeopleTwitter,1536862834.0,29
anime_irl,anime_irl,1536829199.0,229
"""So you have to make bootleg memes in the EU?""",PrequelMemes,1536823838.0,246
Got that hole patched!,NotMyJob,1536828760.0,136
I hate it too yay,FunnyandSad,1536851015.0,33
WhatsApp please.,softwaregore,1536858428.0,42
WCGW if I overtake this biker while talking on the phone?,Whatcouldgowrong,1536823058.0,983
Pepper Spray,polandball,1536839371.0,70
To Compete Against Google,therewasanattempt,1536822800.0,536
Cursed_tubby,cursedimages,1536845003.0,36
I made Bender a few years back. Complete with working chest door!,futurama,1536859341.0,22
Hold that thought,inthesoulstone,1536823150.0,136
My mom just won a local cake competition. So proud!,Damnthatsinteresting,1536820484.0,827
It’s quite simple.,PoliticalHumor,1536841941.0,114
The Bernoulli Principle,woahdude,1536824634.0,172
"A remarkable habit of the Asian house shrew is that it forms a ”caravan” with its young, that is, the young line up behind the mother and follow it while she walks",Awwducational,1536855121.0,25
Usain Bolt races in artificially induced zero/very low gravity.,BeAmazed,1536819884.0,710
Did not expect,yesyesyesno,1536845787.0,53
"Sir, I have located the source of the squeak and eliminated it",rarepuppers,1536820040.0,98
"People shown photos of politicians they're not familiar with can make better-than-chance judgments about whether those politicians have been convicted of corruption, even without knowing anything about the politicians or their careers, with a link to wider faces, finds a new Caltech study (N = 325).",science,1536821391.0,462
This made me laugh and made my day very positive.,funny,1536859022.0,100
A Little Sketch,oddlysatisfying,1536851720.0,27
The wrath of the stoner art student,ProRevenge,1536854036.0,78
"My bank is refusing to return £1,400 of unauthorised payments. I go to Uni in 7 days. What do I do?",personalfinance,1536853575.0,156
"Mods are busy, upvote this mustang hitting a cuclist",IdiotsInCars,1536822179.0,167
"It’s time for a four-day work week, argues labour expert - Thanks to technological advancements, a four-day working week is easily in reach",technology,1536821889.0,736
Get outta here with your soft hands,iamverybadass,1536845495.0,126
The chance of you dying on the way to get lottery tickets is probably greater than your chance of winning it,Showerthoughts,1536852403.0,160
"Unusual Mont Saint-Michel Photograph, take at night, it's look like a Fairy tale",pics,1536858062.0,122
What do you mean you wanted to have fun?,webcomics,1536858496.0,11
ETH vs. Apple products,CryptoCurrency,1536860044.0,77
Usain Bolt races in artificially induced zero/very low gravity.,BeAmazed,1536819884.0,710
"Sir, I have located the source of the squeak and eliminated it",rarepuppers,1536820040.0,100
Smash 3DS (Smash 4) was released 4 years ago today.,smashbros,1536854425.0,84
"People shown photos of politicians they're not familiar with can make better-than-chance judgments about whether those politicians have been convicted of corruption, even without knowing anything about the politicians or their careers, with a link to wider faces, finds a new Caltech study (N = 325).",science,1536821391.0,477
"It’s time for a four-day work week, argues labour expert - Thanks to technological advancements, a four-day working week is easily in reach",technology,1536821889.0,783
"Mods are busy, upvote this mustang hitting a cuclist",IdiotsInCars,1536822179.0,171
HBO Joins BBC Drama Series ‘His Dark Materials’ as Co-Producer And Picks Up Worldwide Distribution Rights Outside The U.K.,books,1536834671.0,197
Reddit sucks peen if this gets 2 upvotes I will delete my account,trebuchetmemes,1536836280.0,96
Well.. there it is.,ofcoursethatsathing,1536847403.0,42
Woof😉irl,woof_irl,1536828544.0,23
"Love this, take care guys",wholesomememes,1536819732.0,368
Giving her new brother a warm welcome,AnimalsBeingJerks,1536847496.0,29
meow irl,MEOW_IRL,1536827616.0,35
Every time,BlackPeopleTwitter,1536837714.0,193
I just got one upped,Tinder,1536820787.0,266
Map showing which U.S states have the most Presidents.,MapPorn,1536838708.0,382
When Gollum is at your local rave looking for his precious.,lotr,1536861363.0,32
Petition for Jordan Kimball to replace Colton Underwood as season 23 bachelor.,thebachelor,1536839670.0,107
Thief prank,nonononoyes,1536828737.0,222
Crumbly fucking mess starterpack,starterpacks,1536824050.0,114
"Ok, this is epic.",trashy,1536820497.0,287
Petturit,Suomi,1536841535.0,168
New Chai Spice Black Tea Sleep Number,tumblr,1536823706.0,62
Bitcoin vs Septim,ElderScrolls,1536862334.0,37
Do you remember the first time we were here?,Eyebleach,1536856589.0,14
One of the last surviving picture of my mohawk.,blunderyears,1536857154.0,69
Amen,terriblefacebookmemes,1536840140.0,140
How could you do this to me???,WatchPeopleDieInside,1536827854.0,69
"Sleeping Cat. Ivory, 19th century, Japan [2100x1600]",ArtefactPorn,1536856743.0,15
Baby surprised by a Powerwasher.,ChildrenFallingOver,1536859730.0,15
Thief prank,instantkarma,1536854509.0,49
Amethyst Geode Agate carved skull,interestingasfuck,1536833320.0,118
See the car?,confusing_perspective,1536834941.0,73
Ken M on Horses,KenM,1536862833.0,12
"This is Onion, you could call her an Onion Loaf",Catloaf,1536830139.0,67
Karen Gillan posted this on her instagram story,marvelstudios,1536828299.0,180
HMJB while I launch my brother over the fence,holdmyjuicebox,1536854204.0,14
Literally one of my favorite scenes in Harry Potter,harrypotter,1536821457.0,109
What electrical engineers listen to on study breaks,EngineeringStudents,1536848054.0,35
When you don't know what to do after finishing the game,SpidermanPS4,1536853882.0,53
Only need about 100k more until his family can receive the play button #ripstefankarl,teenagers,1536838689.0,68
HyunA and E'Dawn to leave CUBE Entertainment,kpop,1536835403.0,1243
Usain bolt races in reduced gravity,gifs,1536827951.0,1818
How to dress for your first day at a legally-safe-knockoff of Hot Topic,disneyvacation,1536828491.0,77
"Scientists have laid out a step-by-step guide for creating a sustainable research facility on Mars. The first step involves a fleet of base-building robots constructing a 16-foot-wide, 41-foot-tall dome covered in 16 feet of ice for radiation shielding.",space,1536819072.0,581
mangoman51 describes the real impact of a recent discovery about tokamak fusion plasmas,bestof,1536832068.0,144
"Toothpaste dispenser, yo",CrappyDesign,1536863732.0,45
Tyrion and Jon arrive to White Harbor,freefolk,1536833306.0,23
This is my signature “KBound” face. My friends seem to think I wear it a bit better now. Although now they call it the “MBound” face 😂 (my new name is Megan). This past year of transitioning and figuring myself out has been a blast! (Trans Girl - 1yr hormones.),happy,1536832989.0,193
Nailed it,yesyesyesyesno,1536832744.0,65
This guy adopted us a year ago...he still thinks he needs an invitation to come into the house.,aww,1536828833.0,355
who hasn't had crushes on their teachers.,SuddenlyGay,1536815849.0,169
New Chinese Exclusive Chibi Figures,BokuNoHeroAcademia,1536849599.0,34
My work replaced the lamps with ones that are slightly green and now the staff corridor looks like an Alien movie,mildlyinteresting,1536854326.0,64
"And to think, he’s getting payed to do this!",powerwashingporn,1536842973.0,57
The rare sharkhog mating dance,AnimalsBeingDerps,1536816298.0,164
Why walk when you can _____?,AskOuija,1536835011.0,219
Daily Cardio rain or shine,likeus,1536821687.0,57
Life,calvinandhobbes,1536847109.0,11
Idag i Metro,sweden,1536852932.0,24
"TIL of Audie Murphy who was awarded every military combat award for valor available from the U.S. Army, as well as French and Belgian awards for heroism.",todayilearned,1536827322.0,1350
Lockheed F-117 Nighthawk Davis Monthan Air Force Base,aviation,1536845971.0,35
The Bearded Fireworm looks like something out of a horror movie,natureismetal,1536814030.0,797
Comment on a drawing of a female character,justneckbeardthings,1536866477.0,46
Spheribowl,Superbowl,1536859549.0,11
PsBattle: Goats on a rock,photoshopbattles,1536816037.0,148
Giving his buddy a massage,AnimalsBeingBros,1536813891.0,167
All according to plan,memes,1536852626.0,28
Every time that I look in the mirror,suicidebywords,1536854417.0,9
Pizza should have poison in the sauce and the antidote in the crust to kill off those people that don’t eat the crust.,CrazyIdeas,1536858223.0,66
Really Real,WhitePeopleTwitter,1536830912.0,395
Yee,shittyrainbow6,1536859712.0,11
An interesting article,niceguys,1536866428.0,6
HMB while I kill brain cells,holdmybeer,1536845912.0,66
This is amazing,TheLastAirbender,1536815923.0,130
Beautiful Ducati,motorcycles,1536852610.0,82
Microsoft's Video Game Day Tweet celebrates unity amongst platforms.,NintendoSwitch,1536831678.0,218
cApYBaRa SoUP mAdE FRoM LivE aNiMALs!,PeopleFuckingDying,1536817994.0,81
[1101x614] The Edouard Bohlen 1907 located on the Skeleton Coast Namibia 🇳🇦 The desert sands began to overtake the beach and caused a dramatic shift to the coastline. It is grounded 500meters/1640ft from the ocean.,AbandonedPorn,1536842406.0,22
Meet Minnie and her teefies,teefies,1536828709.0,18
"The vase i printed using the tips yesterday ended up perfect. No burrs, strings, or marks visible. Huge thank you to the community.",3Dprinting,1536821543.0,166
ITAP of an art exhibit in Tokyo,itookapicture,1536822438.0,41
I Had A Dildo Removed From My Butt,confession,1536859044.0,107
Pulling up behind a sewage truck,Wellthatsucks,1536812936.0,528
[Legit] Incense,BoneAppleTea,1536821441.0,97
One thing that was super important to us while we were making our game (Verlet Swing) was having super tight hitboxes so our players could find little cracks to squeeze through. Here's one instance of those cracks.,HitBoxPorn,1536833186.0,262
While I train for the zombie apocalypse,holdmyredbull,1536837869.0,90
A brilliant tuned mass damper demonstration with simple paper,educationalgifs,1536812501.0,146
Water Temple by Tom Garden,zelda,1536821548.0,75
Tiger smiles,hardcoreaww,1536852086.0,2
NBA 2K19 Is A Pay-To-Win Sham (And They Just Nerfed XP Gains),pcgaming,1536837702.0,253
Science,technicallythetruth,1536822172.0,29
This birb,PartyParrot,1536845555.0,7
Oof,HistoryMemes,1536824985.0,85
hey hooman i want treats,noisygifs,1536861627.0,12
The goodest hospital volunteer,dogswithjobs,1536815087.0,79
A friendly arm wrestling competition goes bad...,HadToHurt,1536814555.0,80
Is it the norm in college to be alone for majority of the day?,college,1536820962.0,57
"What's something a guy did in bed that really turned you on, but you didn't know you would find it that hot/sensual/sexy/fun?",askgaybros,1536824501.0,155
Adorable,comics,1536795604.0,127
Nice Speakers,indianpeoplefacebook,1536839588.0,29
"Just a overgrown cat, nothing to see here",ANormalDayInRussia,1536796421.0,137
"We tried making a cake for my mom’s birthday. Problem is, we have no experience with making cakes",shittyfoodporn,1536779322.0,825
"Lady, I'm about the same height as their freezers, I really don't work here.",IDontWorkHereLady,1536778712.0,236
This camera guy might think about changing up careers,PraiseTheCameraMan,1536825939.0,25
I’m at a lose for words,PUBG,1536846604.0,42
Watch the video Nebraska submitted to the Big Ten and Pac-12 of Adrian Martinez's injury | Football | journalstar.com,CFB,1536821052.0,340
MCU Thor replaces Kratos in God of War 4 can he clear the Game?,whowouldwin,1536814582.0,78
Ryan Hall vs BJ Penn predictions?,bjj,1536834493.0,97
This was my amazing gf she passed away yesterday from brain cancer. She was everything to me. I’ll always be there with her. I know your on to your next adventure. I love you Pusheen.,lastimages,1536802739.0,194
I found a fellow network engineer on Tinder,networking,1536845804.0,49
[Mueller] Just talked to Nelson Cruz in the clubhouse. He appeared to be holding back some emotions. Said it’s frustrating to be in this position and noted that he came to Seattle to get them to the playoffs and hasn’t been able to do that.,Mariners,1536837337.0,57
bad_joke.png,splatoon,1536827216.0,43
Really Real,WhitePeopleTwitter,1536830912.0,395
September 12,MURICA,1536790662.0,315
"I lost my BFF to Plexus. Sadly, I had to cut her off after she used every tragedy/flu/situation to try and sell me Plexus.",antiMLM,1536844972.0,107
The Boston Red Sox have reached 100 wins for the first time since 1946.,baseball,1536832304.0,176
Why can't all instructions be this clear?,CasualUK,1536804836.0,242
Headless Person,creepy,1536785070.0,244
Wikipedia Leads Effort to Create a Digital Archive of 20 Million Artifacts Lost in the Brazilian Museum Fire,history,1536807821.0,80
"The vase i printed using the tips yesterday ended up perfect. No burrs, strings, or marks visible. Huge thank you to the community.",3Dprinting,1536821543.0,166
I Had A Dildo Removed From My Butt,confession,1536859044.0,107
ITAP of an art exhibit in Tokyo,itookapicture,1536822438.0,41
Pulling up behind a sewage truck,Wellthatsucks,1536812936.0,528
[Legit] Incense,BoneAppleTea,1536821441.0,97
One thing that was super important to us while we were making our game (Verlet Swing) was having super tight hitboxes so our players could find little cracks to squeeze through. Here's one instance of those cracks.,HitBoxPorn,1536833186.0,262
While I train for the zombie apocalypse,holdmyredbull,1536837869.0,90
hey hooman i want treats,noisygifs,1536861627.0,12
A brilliant tuned mass damper demonstration with simple paper,educationalgifs,1536812501.0,146
This birb,PartyParrot,1536845555.0,7
Water Temple by Tom Garden,zelda,1536821548.0,75
Tiger smiles,hardcoreaww,1536852086.0,2
NBA 2K19 Is A Pay-To-Win Sham (And They Just Nerfed XP Gains),pcgaming,1536837702.0,253
Science,technicallythetruth,1536822172.0,29
Upvote for Africa by TOTO,dank_meme,1536861739.0,8
Oof,HistoryMemes,1536824985.0,85
The goodest hospital volunteer,dogswithjobs,1536815087.0,79
TRIGGERED,PewdiepieSubmissions,1536861247.0,35
"Being offended by ""cultural appropriation"" is peak stupidity",unpopularopinion,1536862613.0,121
Who is responsible for this...,gaming,1536820568.0,496
Last one,Memes_Of_The_Dank,1536855227.0,10
Impressing a Princess,youseeingthisshit,1536813763.0,92
Hiding out in our farm’s greenhouse during a rainstorm,raining,1536825306.0,57
Ive got my eyes on you,evilbuildings,1536819795.0,50
"The village of Bures, UK this morning.",MostBeautiful,1536852644.0,12
Naomi Osaka is reportedly set to sign Adidas' biggest deal with a female athlete — and it could make her one of the highest-paid women in sports,sports,1536809196.0,2841
TRIGGERED,PewdiepieSubmissions,1536861247.0,35
He saw a chance and he took it,BetterEveryLoop,1536810817.0,202
"I made a seven layer, eight pound lasagne with homemade pasta, bolognese, bechamel, ricotta and spinach. Timelapse of the build in the comments.",FoodPorn,1536827295.0,87
Last one,Memes_Of_The_Dank,1536855227.0,10
It still lives!?,2healthbars,1536835959.0,26
"The village of Bures, UK this morning.",MostBeautiful,1536852644.0,12
"Not only will Tesla’s next gen car cook your breakfast, it will also quickly &amp; painfully teleport you to your destination.",wheredidthesodago,1536810577.0,137
Everyday after school I’m greeted by this delight,MasterReturns,1536819760.0,28
2019 Ferrari 488 Pista dressed in blue,carporn,1536825457.0,42
Terry Crews just took a selfie with Big Bird,CrewsCrew,1536810599.0,157
The Saizo,FireEmblemHeroes,1536824997.0,147
Made this in school as a pop art project :),PUBATTLEGROUNDS,1536834425.0,74
Begone,youdontsurf,1536854063.0,7
"""So you have to make bootleg memes in the EU?""",PrequelMemes,1536823838.0,248
Reddît Bans Qanon Subreddits After Series of Violent Threats,news,1536823884.0,3392
“This never would’ve happened if you didn’t make me hit you!!!!”,Nicegirls,1536818614.0,202
OMG the innocence of a child &lt;333,im14andthisisdeep,1536852563.0,24
"Shipping Things, a Uline order catalog I found at work",crappyoffbrands,1536840110.0,62
Anyone else?,BikiniBottomTwitter,1536822925.0,198
Chunky floof zooms,Zoomies,1536822326.0,24
Six door Prius,ATBGE,1536809034.0,376
Good times gone bad,trippinthroughtime,1536823113.0,15
"A lot of you liked the Bojack piece I posted a few months ago, finished this today in anticipation of the new season!",BoJackHorseman,1536821145.0,85
Fixing her arm...,Cyberpunk,1536829881.0,42
That's some neat space saving design.,DesignPorn,1536830812.0,103
"Teachout: As Attorney General, I will sue Trump, investigate corruption in Albany, break up corporate monopolies &amp; lead the fight to end mass incarceration. I'm a former death penalty defense lawyer, ready for hard high-stakes fights, and an anticorruption expert. I hope I earn your vote. (NY-AG)",BlueMidterm2018,1536811373.0,243
Anon is a cyclist,greentext,1536832094.0,52
Just found this fun little set @ Target! Can't find any mention of it anywhere...,lego,1536830401.0,112
Vitamin Candles,antiMLM,1536823907.0,48
These two pens at my office.... Nothing can possibly go wrong,mildlyinfuriating,1536807960.0,201
A little t shirt design I made,outrun,1536815147.0,147
HMC While I jump on this trampoline.,holdmycosmo,1536852443.0,7
One final chance to set thing right,StarWars,1536811988.0,687
What is this feeling?,arresteddevelopment,1536864175.0,4
The adoration of St. George,AccidentalRenaissance,1536810743.0,104
Nice Speakers,indianpeoplefacebook,1536839588.0,29
One Piece: Chapter 917,OnePiece,1536847708.0,1055
Extra crispy,PublicFreakout,1536832597.0,135
American Dream according to the 2nd highest paid player in the NFL,MurderedByWords,1536817774.0,318
The Greater Good?!,Breath_of_the_Wild,1536821812.0,129
Rip,drunk,1536812458.0,90
"Last week my PS4 started identifying as an XBOX and now it completely transitioned. I NEED MY PS4 BACK &amp; the sexual reassignment procedure costs $50,000. 1 like = 1 dollar towards the surgery",Gamingcirclejerk,1536854370.0,25
Dave Grohl is an amazing tipper with a good sense of humor,pics,1536860006.0,221
Penis,ComedyCemetery,1536812605.0,221
Water physics,blackmagicfuckery,1536814080.0,74
"[WP] People have threat levels assigned to them. Common thug maybe reach double digits, dictators the hundreds, the people who can launch nukes in the hundreds of thousands. You, a scientist who just performed a harmless experiment, suddenly get shot up into the billions",WritingPrompts,1536835039.0,68
I drew Naruto and Pain. I hope you like it!,Naruto,1536826599.0,68
"Last week I handed in my notice, yesterday 1/3 of IT got walked out the door.",sysadmin,1536863325.0,129
"If a genie grants you the opportunity to ejaculate $50 in cash instead of sperm every time you cum for the rest of your life meaning you can't have any more children, would you accept? Why, why not?",AskReddit,1536814042.0,10572
Got love for the bees too!,wholesomebpt,1536810081.0,112
Every stereotypical “Jock” you’ve ever seen in a movie or TV show was actually played by a real-life “drama kid”.,Showerthoughts,1536825569.0,198
"Came down for lunch and found the cop helping a guy tie his tie. Guessing for an interview. Good for these guys, go humans!",HumansBeingBros,1536808244.0,192
One dog has ear medicine she needs and the other one also thinks he needs it too,MadeMeSmile,1536828420.0,30
Does anyone else say it along with them?,brooklynninenine,1536816897.0,69
My third shift buddy. She adjusted to my new work schedule better than I thought she would.,corgi,1536808779.0,56
Life with social anxiety,socialanxiety,1536856066.0,15
"He slides away in his office chair, dodging the granade blast.",breathinginformation,1536852991.0,9
"Jax, sweetheart and terror all in one kitten",curledfeetsies,1536828455.0,33
"In a twist that no one saw coming, LAOP was fired for being so offensive to a woman that his company was banned from a hotel",bestoflegaladvice,1536834178.0,605
QUINTESSENTIAL,funhaus,1536840036.0,19
Decided to clean up the tomatoes today and someone decided she needed a little snack.,gardening,1536815405.0,122
Cat.,CatsStandingUp,1536850744.0,17
The $445 SCAM at McDonald's- How AAA Breakthrough Towing is Cheating People of Their Cars and Money,videos,1536831390.0,496
"This popped up on my Facebook feed, and it gave me a chuckle",Military,1536822822.0,41
Local vineyard forced to shut down as nearly entire season's harvest is stolen in one night.,iamatotalpieceofshit,1536816593.0,306
My wonderful friend drew this for our mutual friend that had lost one of her dogs. Wanted to give him and the good boy Monty some love.,drawing,1536826191.0,37
What a transformation,AccidentalRacism,1536857997.0,14
The elusive mudderfly.,WhatsWrongWithYourDog,1536805515.0,307
Thursday! Hope this is worthy. Green Sharpie on a PostIt.,PenmanshipPorn,1536821079.0,49
"Robin Williams, 1960s",OldSchoolCool,1536819568.0,316
A 1 s electron being excited into a 2 pz orbital,chemistry,1536851405.0,39
the best advice one can get about learning linux. feel free to grab the high-res of this poster and hang it on your wall.,linuxmasterrace,1536858031.0,38
"[OC] Only 100% legit guild contracts here... Definitely no Orc traps, no sir!",DnD,1536815779.0,142
Video of the bong my partner and I have been working on for 4 years (follow up to image posted earlier),StonerEngineering,1536826888.0,110
r/GreatAwakening has been BANNED,TopMindsOfReddit,1536806340.0,5768
Where body builders go to look bigger,whitepeoplegifs,1536819630.0,26
Kanye’s IG is literally brightening my life x1000 🌊🌊🌊,Kanye,1536830753.0,25
I didn't know this subreddit existed until someone told me to post this here,birdswitharms,1536840958.0,25
And the lightning to 3.5mm adapter is no longer included.,apple,1536807070.0,2628
"Apartment maintenance man saw me in a state of undress, put his finger in my mouth.",legaladvice,1536822507.0,331
Pussy Riot member hospitalised 'after losing sight and ability to move' as family fear he's been poisoned,worldnews,1536815066.0,2600
When you’re at a meeting but you can’t stop thinking about D&amp;D,DungeonsAndDragons,1536819801.0,44
FWD: CUT FROM THE SAME CLOTH!,forwardsfromgrandma,1536859035.0,30
Just some capybaras taking a hot bath.,oddlysatisfying,1536816868.0,527
MRW an expensive car isn’t slowing down as I cross the street and I’m a broke college student,reactiongifs,1536802596.0,207
Man Vs Chair,IdiotsFightingThings,1536828850.0,98
Wil Wheaton (46) is now almost the same age Patrick Stewart was when TNG started (47). Doesn't seem possible.,startrek,1536835872.0,175
"(my first Sbubby, be gentle) vOWOlkswagon",sbubby,1536825868.0,42
