title,subreddit,created,num_comments
When you realize r/CringeAnarchy is being flooded with refugees from recently banned subs,CringeAnarchy,1536860887.0,84
Battlefield 4 comes out-,BattlefieldV,1536849285.0,139
CMV: There is nothing morally wrong with eating animal byproducts when the animal is raised ethically and the byproducts would be wasted otherwise.,changemyview,1536841895.0,237
Wil Wheaton (46) is now almost the same age Patrick Stewart was when TNG started (47). Doesn't seem possible.,startrek,1536835872.0,160
"Article 13 memes are about to be hot, get ready to profit!!",MemeEconomy,1536817828.0,2454
Here are some tips for how to care for your grieving friend,coolguides,1536794489.0,161
Man explains the true meaning of confederate war flag,trashy,1536793257.0,554
Paradox TOS is holding your copy of Cities: Skylines hostage if you don't agree to let them give out your personal data.,paradoxplaza,1536842527.0,104
I decided to take a break crime fighting and allow law enforcement take care of the last goon. 4 Officers vs 1 henchmen. Amazing AI.,gaming,1536807251.0,1206
American Dream according to the 2nd highest paid player in the NFL,LateStageCapitalism,1536793469.0,435
Ladies of Reddit - what are some common sexual behaviours that you actually hate?,AskReddit,1536809946.0,1151
My boss phat FIREd today. 45 years old. He couldn’t take any more of the corporate bullshit.,financialindependence,1536829779.0,202
Awesome.,funny,1536830572.0,92
September 12,MURICA,1536790662.0,314
Creative Director of Spider-Man PS4 Says It 'Would Not Exist if It Wasn't for PlayStation',PS4,1536795592.0,698
"Mussolini: ""I want to be Caesar!"" - *becomes Caligula*",HistoryMemes,1536796328.0,161
"Teachout: As Attorney General, I will sue Trump, investigate corruption in Albany, break up corporate monopolies &amp; lead the fight to end mass incarceration. I'm a former death penalty defense lawyer, ready for hard high-stakes fights, and an anticorruption expert. I hope I earn your vote. (NY-AG)",BlueMidterm2018,1536811373.0,238
Extra crispy,PublicFreakout,1536832597.0,108
"A lot of you liked the Bojack piece I posted a few months ago, finished this today in anticipation of the new season!",BoJackHorseman,1536821145.0,80
"A Secret Google video leaked from 2016 election shows Google working for Hillary with soft campaign contributions. Reveals hate for patriotism and nationalism, promotion of globalism. Lack of conservative diversity and understanding. Speakers include Larry Page and Sergey Brin and other executives.",AskThe_Donald,1536819911.0,94
"And to think, he’s getting payed to do this!",powerwashingporn,1536842973.0,47
The Glory hole gang and the case of the bitten pee pee.,ems,1536828836.0,80
These two pens at my office.... Nothing can possibly go wrong,mildlyinfuriating,1536807960.0,198
The best defense against oneitis is to learn how to love women. Appropriately.,TheRedPill,1536838986.0,54
How many of you quit your jobs before travelling?,solotravel,1536828085.0,124
Made this in school as a pop art project :),PUBATTLEGROUNDS,1536834425.0,72
A little t shirt design I made,outrun,1536815147.0,144
"Europe just voted to wreck the internet, spying on everything and censoring vast swathes of our communications - Cory Doctorow",privacy,1536803315.0,145
don't tell me this isn't relatable,teenagers,1536811218.0,76
Immediately gets reported to police,iamverybadass,1536787843.0,2449
"OITNB always gets praised for their flashback casting choices, but I think IASIP did it better.",IASIP,1536820840.0,59
I bought a 70 pt. Dehumidifier over a month ago and have been running it in my 1600 sq. Ft. House. Before I bought the house it was vacant for a year. I have been dumping 3-4 full buckets a day. I was wondering about how long it would take to bring down the humidity for good &amp; not dumping so much.,HomeImprovement,1536830910.0,137
One final chance to set thing right,StarWars,1536811988.0,666
Cleaning a DE pool filter,powerwashingporn,1536815952.0,76
"Middle-class income hit an all-time high of $61,372 last year, U.S. Census Bureau says",investing,1536797694.0,344
"Struggling with binge-eating or late-night snacking? Try the ""annoying toddler"" method!",xxfitness,1536811685.0,53
USB-C audio sucks: Bring back the headphone jack!,Android,1536797185.0,431
The adoration of St. George,AccidentalRenaissance,1536810743.0,104
Good times gone bad,trippinthroughtime,1536823113.0,13
I think I'm depressed but I can't stop lying about it,TheGirlSurvivalGuide,1536822443.0,33
Fixing her arm...,Cyberpunk,1536829881.0,41
The adoration of St. George,AccidentalRenaissance,1536810743.0,104
Every time that I look in the mirror,suicidebywords,1536854417.0,2
Tiger smiles,hardcoreaww,1536852086.0,1
American Dream according to the 2nd highest paid player in the NFL,MurderedByWords,1536817774.0,307
"TIL of Audie Murphy who was awarded every military combat award for valor available from the U.S. Army, as well as French and Belgian awards for heroism.",todayilearned,1536827322.0,1313
Rip,drunk,1536812458.0,88
Penis,ComedyCemetery,1536812605.0,220
Beautiful Ducati,motorcycles,1536852610.0,72
Ken M on Horses,KenM,1536862833.0,7
Water physics,blackmagicfuckery,1536814080.0,74
Just found this fun little set @ Target! Can't find any mention of it anywhere...,lego,1536830401.0,105
"If a genie grants you the opportunity to ejaculate $50 in cash instead of sperm every time you cum for the rest of your life meaning you can't have any more children, would you accept? Why, why not?",AskReddit,1536814042.0,10541
The Greater Good?!,Breath_of_the_Wild,1536821812.0,120
Got love for the bees too!,wholesomebpt,1536810081.0,113
Baby surprised by a Powerwasher.,ChildrenFallingOver,1536859730.0,8
"Came down for lunch and found the cop helping a guy tie his tie. Guessing for an interview. Good for these guys, go humans!",HumansBeingBros,1536808244.0,189
Vitamin Candles,antiMLM,1536823907.0,44
That's some neat space saving design.,DesignPorn,1536830812.0,89
My third shift buddy. She adjusted to my new work schedule better than I thought she would.,corgi,1536808779.0,54
"Shipping Things, a Uline order catalog I found at work",crappyoffbrands,1536840110.0,50
One Piece: Chapter 917,OnePiece,1536847708.0,970
I drew Naruto and Pain. I hope you like it!,Naruto,1536826599.0,66
Does anyone else say it along with them?,brooklynninenine,1536816897.0,68
Nice Speakers,indianpeoplefacebook,1536839588.0,27
Begone,youdontsurf,1536854063.0,7
The elusive mudderfly.,WhatsWrongWithYourDog,1536805515.0,305
This is a Garlic Bread Made with 1600 Characters,GarlicBreadMemes,1536832972.0,31
I like the way he thinks,vegan,1536831170.0,64
"This popped up on my Facebook feed, and it gave me a chuckle",Military,1536822822.0,38
One dog has ear medicine she needs and the other one also thinks he needs it too,MadeMeSmile,1536828420.0,29
It still lives!?,2healthbars,1536835959.0,24
My wonderful friend drew this for our mutual friend that had lost one of her dogs. Wanted to give him and the good boy Monty some love.,drawing,1536826191.0,37
Spheribowl,Superbowl,1536859549.0,6
"Jax, sweetheart and terror all in one kitten",curledfeetsies,1536828455.0,32
HMC While I jump on this trampoline.,holdmycosmo,1536852443.0,6
r/GreatAwakening has been BANNED,TopMindsOfReddit,1536806340.0,5753
Extra crispy,PublicFreakout,1536832597.0,109
Local vineyard forced to shut down as nearly entire season's harvest is stolen in one night.,iamatotalpieceofshit,1536816593.0,275
Thursday! Hope this is worthy. Green Sharpie on a PostIt.,PenmanshipPorn,1536821079.0,50
QUINTESSENTIAL,funhaus,1536840036.0,18
And the lightning to 3.5mm adapter is no longer included.,apple,1536807070.0,2593
"Nintendo Co., Ltd. apply for new Golden Sun videogame trademark",nintendo,1536858938.0,47
Yee,shittyrainbow6,1536859712.0,8
Video of the bong my partner and I have been working on for 4 years (follow up to image posted earlier),StonerEngineering,1536826888.0,105
"[OC] Only 100% legit guild contracts here... Definitely no Orc traps, no sir!",DnD,1536815779.0,130
hey hooman i want treats,noisygifs,1536861627.0,11
Last one,Memes_Of_The_Dank,1536855227.0,9
MRW an expensive car isn’t slowing down as I cross the street and I’m a broke college student,reactiongifs,1536802596.0,205
When you’re at a meeting but you can’t stop thinking about D&amp;D,DungeonsAndDragons,1536819801.0,44
"In a twist that no one saw coming, LAOP was fired for being so offensive to a woman that his company was banned from a hotel",bestoflegaladvice,1536834178.0,561
One of the last surviving picture of my mohawk.,blunderyears,1536857154.0,42
Nice guys Goosebumps. Courtesy of @adamtots,niceguys,1536810459.0,114
Pizza should have poison in the sauce and the antidote in the crust to kill off those people that don’t eat the crust.,CrazyIdeas,1536858223.0,35
Cat.,CatsStandingUp,1536850744.0,15
"Apartment maintenance man saw me in a state of undress, put his finger in my mouth.",legaladvice,1536822507.0,317
How to improve your Critical Thinking skills,philosophy,1536824297.0,139
Man Vs Chair,IdiotsFightingThings,1536828850.0,91
I didn't know this subreddit existed until someone told me to post this here,birdswitharms,1536840958.0,25
My friend is an elementary school teacher,KidsAreFuckingStupid,1536803550.0,238
"[WP] People have threat levels assigned to them. Common thug maybe reach double digits, dictators the hundreds, the people who can launch nukes in the hundreds of thousands. You, a scientist who just performed a harmless experiment, suddenly get shot up into the billions",WritingPrompts,1536835039.0,51
The Atlanta Braves have clinched their first winning season since 2013 with their 82nd win,baseball,1536821367.0,176
Reddît Bans Qanon Subreddits After Series of Violent Threats,news,1536823884.0,3282
This could be us...,im14andthisisdeep,1536836366.0,52
"He slides away in his office chair, dodging the granade blast.",breathinginformation,1536852991.0,9
Jokeception,WhitePeopleTwitter,1536862834.0,15
"The village of Bures, UK this morning.",MostBeautiful,1536852644.0,10
Kanye’s IG is literally brightening my life x1000 🌊🌊🌊,Kanye,1536830753.0,23
"Ever wondered why was there chicken in the room when Phil, Stu and Alan wake up in the movie Hangover? In the DVD Commentary Todd Phillips reveals that the guys brought it because they wanted to feed the tiger.",MovieDetails,1536803122.0,150
Wanna take the shortcut?,creepy,1536810770.0,213
"I'm happy that Aquaria and Miz Cracker were nominated for People's Choice Awards, but I'm struggling to believe that the greatest gift to television was not. She's a production.",rupaulsdragrace,1536823780.0,121
Anyone else?,BikiniBottomTwitter,1536822925.0,196
Where body builders go to look bigger,whitepeoplegifs,1536819630.0,25
"(my first Sbubby, be gentle) vOWOlkswagon",sbubby,1536825868.0,39
ik_ihe,ik_ihe,1536851381.0,11
Wil Wheaton (46) is now almost the same age Patrick Stewart was when TNG started (47). Doesn't seem possible.,startrek,1536835872.0,160
"The U.S.-Mexico Soccer Rivalry Is Getting Bitter, Petty, Ridiculous, and It’s Great for Both Countries",MLS,1536798855.0,214
"Google is discontinuing Inbox, focusing on Gmail",Android,1536804492.0,1716
He says he wasn't going to kill me...,LetsNotMeet,1536805397.0,82
EU basterds,PrequelMemes,1536795840.0,348
"Sometimes I feel like I’m not “bisexual enough” to call myself bisexual, so I like this.",bisexual,1536820095.0,113
"The village of Bures, UK this morning.",MostBeautiful,1536852644.0,11
My teacher rotates memes on her board every week. This is the best one so far.,FellowKids,1536800645.0,348
looking fabulous with my hair do,reallifedoodles,1536804513.0,53
Anyone else?,BikiniBottomTwitter,1536822925.0,196
Evolution of Floof 9 years in making,Floof,1536817569.0,29
"TIL that the territory of Nevada was rushing to become a state in time for the 1864 presidential election. After writing a state constitution with only days to spare, they sent all 16,543 words of it to Congress via telegram. Transmission took 2 full days and cost $4,303.27 (over $67,000 today.)",todayilearned,1536828206.0,145
I’ve always imagined myself retiring in a small stone cottage.,CozyPlaces,1536799617.0,317
The folks from GA are on voat now and have a thread about brigading TMOR,TopMindsOfReddit,1536844145.0,101
*eats half a cake* yeah i eat,thatHappened,1536805746.0,423
"""There is no god!"" Soviet Anti-Religion, 1988",PropagandaPosters,1536825025.0,194
[Post-Series Thread] The Brewers take 2 of 3 from the Cubs at Wrigley Field.,baseball,1536837856.0,311
I’ve always worked in refineries where safety is usually top priority. Now that I’m working commercial I’m amazed at what I’ve seen.,OSHA,1536801209.0,494
"This might not seem like a lot to you guys, but for a broke college kid who stalks this subreddit daily, this is a huge W",MechanicalKeyboards,1536828051.0,109
How to easily teach multiplication tables,lifehacks,1536802044.0,321
"Sadio Mané: ""I remember that when I was little, my parents felt that I should study to become a teacher. They thought football was a waste of time and I'd never succeed at it. I always said: 'This is the only job that will enable me to help you. And I think I have a chance to become a footballer.'""",LiverpoolFC,1536854038.0,25
"""No, pick me!!!"" (ZoologyKaM on Deviantart)",DDLC,1536824662.0,89
A 1 s electron being excited into a 2 pz orbital,chemistry,1536851405.0,35
the best advice one can get about learning linux. feel free to grab the high-res of this poster and hang it on your wall.,linuxmasterrace,1536858031.0,35
...whatever you say!,thatHappened,1536811618.0,109
Doc about donations today,LivestreamFail,1536799657.0,282
Mast Down,MetalMemes,1536836429.0,2
"""Believe in something. Even if it means sacrificing everything.""",CringeAnarchy,1536815625.0,94
Pear picker,ArtisanVideos,1536786413.0,109
Smooby Cheese,smoobypost,1536804589.0,15
Friendly Tigger.. No need to fear,BigCatGifs,1536811764.0,35
Tranz music video coming out tomorrow!,gorillaz,1536793584.0,116
Day 3. No Tribunal Decision.,exmormon,1536821545.0,69
This guy weaving in a Freeway.,IdiotsInCars,1536800916.0,2100
Speaker: Rare birds in 1080 protest 'bludgeoned to death',newzealand,1536841953.0,108
Streamer with a bad attitude rage quits after losing to a teenage girl,FortNiteBR,1536817901.0,519
[Hamilton] My late fathers pocket watch that sat in a safety deposit box for 30+ years...,Watches,1536815747.0,44
Hiked up Mt. Fuji to see the sunrise. [OC],japanpics,1536847267.0,3
"Hands Up, Don't Shoot",BlackPeopleTwitter,1536799101.0,125
Brown people dont count,LateStageCapitalism,1536786381.0,93
Couldn’t even label the suitcase because it could be ANYTHING,dndmemes,1536837474.0,7
My mom thought she got a great bargain on a cooking pot,funny,1536825584.0,1470
The most important point of yesterday's keynote was given by Lisa Jackson: Phones are going to last longer.,apple,1536853667.0,41
I am a lowly script reader looking to pass on some knowledge... eventually,Screenwriting,1536831159.0,56
Canadian // Chinese,MixedRaceGirls,1536861023.0,3
"Clerk has a heart attack, these guys rob the store.",videos,1536825430.0,199
good idea,MildlyVandalised,1536839240.0,2
"If you haven't seen ""The Wailing"" yet on Netflix—do yourself a favor and just watch it.",horror,1536847994.0,46
Not every game needs to sell 500k - Devolver,pcgaming,1536793934.0,162
The #NintendoSwitchOnline paid membership service will start on 19/09. You can sign-up for a 7-day free trial from Nintendo #eShop at launch!,NintendoSwitch,1536789809.0,1104
Uninteresting title,teenagers,1536849375.0,14
Newborn goat adopts sleepy baby chicken,aww,1536835615.0,13
r/smashbros will be locked for the duration of the Nintendo Direct along with other news,smashbros,1536863401.0,31
How do I ask an owl nicely not to attack me?,running,1536844744.0,66
Windows Defender in a Nutshell,hacking,1536825562.0,61
Approaching daddy....with caution,aww,1536811182.0,23
Where body builders go to look bigger,whitepeoplegifs,1536819630.0,25
Netflix Confirms Norm’s Show Is Still On,NormMacdonald,1536830119.0,83
"How come some days you'll look in the mirror and see the sexiest motherfucker that ever lived, and other days you'll see a horribly ugly person?",NoStupidQuestions,1536816279.0,51
I bought a key chain in Spain for my kid and just noticed it has a ballsack,mildlyinteresting,1536794730.0,89
Microsoft to 'warn' Windows 10 users not to install Chrome or Firefox,sysadmin,1536791962.0,525
This slogan on a tow truck.,mildlyinteresting,1536794525.0,60
This ad,AccidentalRacism,1536808170.0,48
Chemistry between these two was amazing. Such a great bromance. I want more,Defenders,1536817806.0,63
Begone,youdontsurf,1536854063.0,7
My drawing for Week 2 of the AFL finals series,AFL,1536856435.0,43
Members of the Opposition are being removed from the Legislative Assembly of Ontario,ontario,1536810021.0,316
"Spotify raises limit for offline downloads to 10,000 songs per device",Android,1536816298.0,149
How many of you quit your jobs before travelling?,solotravel,1536828085.0,124
Join the Anti-Ban Petition and Show the Admin who Should Really Be Banned! /r/BanBanouts,TheRedPill,1536801897.0,165
Remember the names of those who sold out our internet.,ireland,1536858543.0,69
Depression and D&amp;D,DnD,1536844653.0,22
ZOTAC GTX 1080 Mini ($500) or MSI 1070 Ti Titanium ($480)?,buildapc,1536814855.0,86
Physics is Fun,Damnthatsinteresting,1536798285.0,166
"America unseats Russia, Saudi Arabia as No. 1 oil producer",geopolitics,1536815869.0,73
I became a proud father today....,Jokes,1536794952.0,83
that fire,battlestations,1536842570.0,14
26 patterns for $3.18 at my local thrift store,sewing,1536820258.0,5
1 Hour on this Planet Is 7 Years on Earth,funny,1536814564.0,394
Om någon ger denna post en downvote så bevisar de att skämtet är sant.,sweden,1536785845.0,385
Rumours for Animal Crossing,NintendoSwitch,1536865897.0,54
furry😔irl,furry_irl,1536808448.0,56
"For his UFC debut, Jan Blachowicz wanted Ilir Latifi. In Sweden.",MMA,1536849185.0,26
2meirl4meirl,2meirl4meirl,1536864201.0,1
Final Fantasy VII: Yuffie cosplay,gaming,1536801260.0,889
My mom thought she got a great bargain on a cooking pot,MadeMeSmile,1536846448.0,7
Tecso Express,crappyoffbrands,1536859064.0,0
Captain America,marvelstudios,1536859545.0,5
C H A I R G I R L E,rarepuppers,1536808867.0,6
This gecko that must’ve choked and died trying to eat a large fly,mildlyinteresting,1536818244.0,100
"If Myrtle Snow gets sentenced to death by burning again, these better be her last words.",AmericanHorrorStory,1536819620.0,43
hmmm,hmmm,1536817951.0,24
Spongebob x Minecraft,Memes_Of_The_Dank,1536850178.0,2
My dad just texted me and said 'Found a rough draft of Trump's Rushmore addition' (OC),pics,1536816238.0,134
"Sleeping Bear Dunes National Lakeshore, Lake Michigan. [OC] [3264x2448]",EarthPorn,1536828497.0,14
Anon is a Zelda fanatic,greentext,1536859904.0,12
Weki Meki To Make October Comeback,kpop,1536838807.0,26
My new hamster made a little den for herself and fell asleep.,aww,1536820747.0,35
I feel like we've bonded as a community this week,smashbros,1536802899.0,207
When you're sitting in class doing nothing.,teenagers,1536849757.0,15
What's the most dangerous risk you've taken in your life?,AskReddit,1536785919.0,2152
Just some capybaras taking a hot bath.,oddlysatisfying,1536816868.0,525
Life can be hard...,ChildrenFallingOver,1536801153.0,150
Got that hole patched!,NotMyJob,1536828760.0,135
CMV: There is nothing morally wrong with eating animal byproducts when the animal is raised ethically and the byproducts would be wasted otherwise.,changemyview,1536841895.0,239
"Google is discontinuing Inbox, focusing on Gmail",Android,1536804492.0,1721
Battlefield 4 comes out-,BattlefieldV,1536849285.0,144
My friend is an elementary school teacher,KidsAreFuckingStupid,1536803550.0,239
"Not only will Tesla’s next gen car cook your breakfast, it will also quickly &amp; painfully teleport you to your destination.",wheredidthesodago,1536810577.0,136
I decided to take a break crime fighting and allow law enforcement take care of the last goon. 4 Officers vs 1 henchmen. Amazing AI.,gaming,1536807251.0,1209
"Article 13 memes are about to be hot, get ready to profit!!",MemeEconomy,1536817828.0,2454
Paradox TOS is holding your copy of Cities: Skylines hostage if you don't agree to let them give out your personal data.,paradoxplaza,1536842527.0,105
What is the dress for,gifs,1536848207.0,153
September 12,MURICA,1536790662.0,314
This is my signature “KBound” face. My friends seem to think I wear it a bit better now. Although now they call it the “MBound” face 😂 (my new name is Megan). This past year of transitioning and figuring myself out has been a blast! (Trans Girl - 1yr hormones.),happy,1536832989.0,180
She asked if I was pregnant in a meeting full of cross functional team members. I’m not.,Advice,1536833779.0,101
I’ve always worked in refineries where safety is usually top priority. Now that I’m working commercial I’m amazed at what I’ve seen.,OSHA,1536801209.0,495
Amphetamine,Drugs,1536804731.0,426
My boss phat FIREd today. 45 years old. He couldn’t take any more of the corporate bullshit.,financialindependence,1536829779.0,209
"Good morning, Bristol!",CasualUK,1536854596.0,132
Joji - SLOW DANCING IN THE DARK [Rap],Music,1536791822.0,672
TooMeIrlForMeIrl,TooMeIrlForMeIrl,1536854054.0,43
Giving his buddy a massage,AnimalsBeingBros,1536813891.0,166
Here are some tips for how to care for your grieving friend,coolguides,1536794489.0,163
Wil Wheaton (46) is now almost the same age Patrick Stewart was when TNG started (47). Doesn't seem possible.,startrek,1536835872.0,163
This does put a smile on my face.,thanosdidnothingwrong,1536817024.0,171
In awe at the size of this lass,AbsoluteUnits,1536798648.0,957
"I called it ""circle haircut"" or ""infinity chinstrap"" and I proudly sported this until a cute girl said I looked like a sunflower. ~2000",blunderyears,1536791009.0,339
Does anyone else say it along with them?,brooklynninenine,1536816897.0,69
cApYBaRa SoUP mAdE FRoM LivE aNiMALs!,PeopleFuckingDying,1536817994.0,80
I thought this a diet supplementary,crappyoffbrands,1536787909.0,214
Just found this fun little set @ Target! Can't find any mention of it anywhere...,lego,1536830401.0,107
That's some neat space saving design.,DesignPorn,1536830812.0,92
"It’s time for a four-day work week, argues labour expert - Thanks to technological advancements, a four-day working week is easily in reach",technology,1536821889.0,704
A Slippery Slope,DnDGreentext,1536797376.0,47
My buddy Matt absolutely destroying his neck last winter.,FullScorpion,1536814260.0,76
The Bearded Fireworm looks like something out of a horror movie,natureismetal,1536814030.0,790
This was my amazing gf she passed away yesterday from brain cancer. She was everything to me. I’ll always be there with her. I know your on to your next adventure. I love you Pusheen.,lastimages,1536802739.0,192
"Love this, take care guys",wholesomememes,1536819732.0,333
Eminem x Sway - The Kamikaze Interview (Part 2),Eminem,1536825739.0,508
The $445 SCAM at McDonald's- How AAA Breakthrough Towing is Cheating People of Their Cars and Money,videos,1536831390.0,460
Got love for the bees too!,wholesomebpt,1536810081.0,113
"Sometimes I feel like I’m not “bisexual enough” to call myself bisexual, so I like this.",bisexual,1536820095.0,113
*eats half a cake* yeah i eat,thatHappened,1536805746.0,425
Never saw it coming,woooosh,1536844179.0,62
Tennessee will provide free tickets to Hurricane Florence evacuees from North and South Carolina for Saturday’s home game w/UTEP,CFB,1536814921.0,291
Pulling up behind a sewage truck,Wellthatsucks,1536812936.0,513
Crumbly fucking mess starterpack,starterpacks,1536824050.0,111
See the car?,confusing_perspective,1536834941.0,70
Amazon doesn't want to cage employees after all.,ABoringDystopia,1536787524.0,90
"iPhone XS, iPhone XS Max and iPhone XR Pricing",iphone,1536806488.0,2500
excuse me can i please come up on the bed?,dogpictures,1536828827.0,7
ILPT: Full Guide on how to Cook Methamphetamine,IllegalLifeProTips,1536843057.0,113
Male Pattern Badness,Justfuckmyshitup,1536829072.0,51
Due to the popular demand I bring you the 1000 random pixels picture. Enjoy,notinteresting,1536806058.0,143
return,comics,1536816562.0,64
Birbie,Birbs,1536811538.0,59
First ever Iron Man poster from 2006 comic con.,marvelstudios,1536814505.0,359
Seal Team 6 operators take one last photo before the night raid that would eventually eliminate Osama bin Laden (5/2/2011).,JoeRogan,1536817381.0,141
"Me waiting for Violet, Tate, and all the other witches to show up",AmericanHorrorStory,1536837877.0,20
hope u all lik (oWo),ExpandDong,1536824302.0,29
I love these two,DarlingInTheFranxx,1536860270.0,7
The beautiful swirly patterns of the recrystallization of 4-hydroxybenzaldehyde placed in icy water,chemicalreactiongifs,1536806435.0,48
part of the Veil nebula,Astronomy,1536836360.0,14
[OC][WIP] I'm working on a game where you can use alchemy to fully customize your weapons!,PixelArt,1536844812.0,29
Mfw a man tells me I should smile more.,LoveNikki,1536859134.0,4
Oof,HistoryMemes,1536824985.0,82
[Homemade] Blackened Cajun Chicken and Shrimp Alfredo,food,1536822908.0,68
"How Birth Control Pills Gave Me My Childhood Back, And How A Pharmacist Tech Threatened That By Making Assumptions",TwoXChromosomes,1536795273.0,985
Collage of Megumin. Enjoy~! (Links below),Megumin,1536849396.0,8
See fewer posts like this,Badfaketexts,1536807960.0,46
Forbidden Wednesday Avocado,forbiddensnacks,1536797808.0,143
So cute!,AteTheOnion,1536845316.0,11
Robert Whittaker shows off his God-tier takedown defense against Jacare Souza,MMA,1536816568.0,232
How purrrfect is my little Will?,tuckedinkitties,1536799019.0,52
