title,subreddit,created,num_comments
"Switch System Update 6.0.0 launching Sept. 18th at 5PM, disables unlinking Nintendo Account",nintendo,1536827174.0,131
Gay🤔irl,gay_irl,1536843367.0,3
My buddy Matt absolutely destroying his neck last winter.,FullScorpion,1536814260.0,76
My drawing for Week 2 of the AFL finals series,AFL,1536856435.0,43
"Self Portrait with Luna, digital, 3000x4000px,",Art,1536844559.0,33
When a great HH main anwsers your SoS call,MonsterHunterWorld,1536854180.0,30
Lucas the little wolf turns 1 year old soon. I want to celebrate this beautiful beast.,redditgetsdrawn,1536825153.0,30
Tagging this Adorable because that robot is risking its life for you,shittyrobots,1536809086.0,46
Too soon?,MURICA,1536847411.0,12
"When I found Riley in a parking lot, he was under 1 pound. Now he's huge and fluffy and my baby and I love him more than anything.",BeforeNAfterAdoption,1536798716.0,48
Exploited,socialism,1536845665.0,29
mrw mommy tells me she just went out and bought tendies,Tendies,1536835790.0,13
Brandi TV’s Grinch makeup tutorial while high on edibles,ContagiousLaughter,1536832860.0,22
"My math teacher, 13 years ago, used to tell us this and it made me a better student:",math,1536854950.0,33
Who remembers this?,Spiderman,1536821914.0,116
Why we say “OK” (2018) - How a cheesy joke from the 1830s became the most widely spoken word in the world.,Documentaries,1536825990.0,65
Windows Defender in a Nutshell,hacking,1536825562.0,63
A Slippery Slope,DnDGreentext,1536797376.0,47
Reddit bans QAnon subreddit,technology,1536812554.0,2499
Biggest bush Rick had since terminus.,thewalkingdead,1536837760.0,35
[Help] I stole my neighbors dog because of neglect. Did I do the right thing?,dogs,1536827321.0,148
My golden has a bigger butt than me,goldenretrievers,1536845453.0,12
When EU bans memes so you circumvent the law by drawing bootleg versions,SonicTheHedgehog,1536861332.0,5
Potato blep,Blep,1536834724.0,3
"LPT: Never assume that someone won't be able to go to an event, it's always better to invite them anyway, that way they know they haven't purposefully been left out. It'll avoid a lot of negativity.",LifeProTips,1536856724.0,31
Nach ARD-Recherche: Maaßen gab Informationen aus unveröffentlichtem Verfassungsschutzbericht an AfD weiter,de,1536856238.0,222
You must wash yourself in the blood,PoliticalHumor,1536811665.0,1161
Meditation is the ONLY way to cure acne,wowthanksimcured,1536827747.0,36
The Castle of Zafra in Spain [8083x5389],ArchitecturePorn,1536851032.0,12
"Just a overgrown cat, nothing to see here",ANormalDayInRussia,1536796421.0,135
Be kind to those evacuating from the hurricane,nova,1536858513.0,11
🅱️ust,DeepFriedMemes,1536831155.0,40
Fratelli d'Italia prova una coreografia in Parlamento,italy,1536864797.0,58
World Rally Blue is the best Blue,subaru,1536827350.0,45
Won't let a pregnant lady sit? Well you can't sit with each other.,pettyrevenge,1536814560.0,453
The most photogenic thing my cats have done...,SupermodelCats,1536835980.0,15
Wholesomeness finds a way 🌷,wholesomememes,1536828784.0,25
First exotic engram,destiny2,1536815091.0,213
"[WIP] When your weekend forecast features a Cat 4 hurricane, you stock up on the important things. 😅",CrossStitch,1536826261.0,66
"My brother didn't make it to the bedside before my father died, but I lied to him so he'd think he did",confessions,1536811474.0,66
"My grandparents bought this 1954 International Harvester fridge new. I just took possession- all original equipment, taps added in the 1970’s.",BuyItForLife,1536819715.0,83
How long can we keep this going for?,EdgyMemes,1536858406.0,5
My bosses dogs like to come into the tractor even though there’s not a lot of room,aww,1536832018.0,74
Jenga is perfect for this subreddit,Prematurecelebration,1536821679.0,26
"Have you ever clicked with someone perfectly and enjoyed each other's company so much, but realized that a long term relationship could never work out? How did you accept that and stop longing to be with that person?",AskWomen,1536825818.0,171
Uninteresting title,teenagers,1536849375.0,16
nothin special happens but shes just so pretty i thought id share,Rabbits,1536832417.0,14
happy boy asks politely,ilikthebred,1536813980.0,24
Absolutely dental,araragi,1536838600.0,44
Poor doggo just wants loving,PetTheDamnDog,1536806785.0,26
"Just got this at BayAreaInk in Concord, CA! Thanks Kyle.",BobsBurgers,1536846226.0,3
Tennessee will provide free tickets to Hurricane Florence evacuees from North and South Carolina for Saturday’s home game w/UTEP,CFB,1536814921.0,291
"Came home yesterday to my life taking a 180. Dad got fired, Mom is probably gonna leave. Heard this song today and I couldn’t hold my emotions. Godspeed to all of you going through a rough time now",FrankOcean,1536812679.0,80
EU's hovedkvarter,Denmark,1536857260.0,24
Here are some tips for how to care for your grieving friend,coolguides,1536794489.0,163
"I got fired. For ""Hitting on a 16 year old""",TalesFromYourServer,1536807127.0,306
"Babish should make the $5 shake, by trying to make the best possible shake with $5.",bingingwithbabish,1536858000.0,13
What do you guys think?,cableporn,1536857655.0,22
Eminem x Sway - The Kamikaze Interview (Part 2),Eminem,1536825739.0,510
Lets post actual cringe before we're banned,CringeAnarchy,1536827616.0,115
Divorce finalized yesterday. Today: Day 1 Post Divorce. Crown and 7 will chill with me tonight while I initiate my next chapter in life. Be happy and show love to all those dear to you. Cheers everyone!,exmormon,1536831302.0,164
‘Twas The Night Before A Double Eviction,BigBrother,1536837576.0,34
My mom thought she got a great bargain on a cooking pot,funny,1536825584.0,1473
The real enemy,neoliberal,1536851093.0,30
"I,too, sat for hours. Badlands National Park. Still gives me chills [OC][872x872]",EarthPorn,1536828455.0,47
Tiny toebean peeps out,jellybeantoes,1536823464.0,2
The Mother and Winter Child by Maciej Kuciara,ImaginaryCharacters,1536828771.0,11
Our server room UPS died right before the hurricane. We had to improvise.,techsupportgore,1536804507.0,274
"Naked, intoxicated Florida man baking cookies on George Foreman grill responsible for house fire",FloridaMan,1536831234.0,24
"Murder, the best way to deny someone freedom.",Libertarian,1536808669.0,318
Cursed_Comment,cursedimages,1536857043.0,37
Spin remote,DidntKnowIWantedThat,1536850746.0,18
An Apology to Nepal -- Jack Douglass,fakealbumcovers,1536815109.0,54
Hot_Dogger,shittyfoodporn,1536817916.0,85
It all makes sense now.,Grimdank,1536839877.0,9
"I see your pictures of Spiti, and raise you this picture I took during the Chadar Trek in Ladakh last year.",india,1536840547.0,33
When people are fleeing communist countries but you and your college professors want to try it one more time...,Anarcho_Capitalism,1536841860.0,31
Happy 22nd Birthday to the beautiful Lili Reinhart!,riverdale,1536855762.0,10
Undersea Restaurant in the Maldives!,TheDepthsBelow,1536790595.0,305
I decided to take a break crime fighting and allow law enforcement take care of the last goon. 4 Officers vs 1 henchmen. Amazing AI.,gaming,1536807251.0,1209
Pro tip: Sort by new before posting.,DragonballLegends,1536864555.0,10
Water shadows,BeAmazed,1536809424.0,249
"""Half-Life 2: Freeman vs. Combine"" | by AndyDaRoo",HalfLife,1536857004.0,12
"Not having trimmed my beard and mustache for 12+ months, and going for some Baroque-styled lighting in that one.",beards,1536819576.0,70
2B sketching an innocent boi,nier,1536852564.0,4
This deformed apple that looks like a big nosed smoker,Pareidolia,1536796425.0,67
"Gary Neville on Pogba: ""As a fan, honestly, part of me is that no one is bigger than the club and I am not interested in people who are looking left and right.""",reddevils,1536847938.0,124
13 ways to kill your freedom.,toosoon,1536807733.0,67
/r/greatawakening has been banned,AgainstHateSubreddits,1536806968.0,588
Texas if it was a Canadian province,vexillology,1536808471.0,136
[OC] Drew my favourite traveler!,octopathtraveler,1536831384.0,36
Sonny’s back at Hotspur Way with his Asian Games medal!,coys,1536858994.0,12
Exeggutor C137,upvoteexeggutor,1536832627.0,7
Trying to sell $200 speakers then a strange turn of events.,ChoosingBeggars,1536826717.0,157
"Kimi's on fire. ""And you still have the hunger to race?"" ""No, actually! I'm just playing head games with you guys, deciding to sign for two years and not be happy!"" #F1",formula1,1536862126.0,35
I got the Ray Gun then this happened...,Blackops4,1536814018.0,120
With hurricane Florence approaching I want to post this guide I made from a couple years back on how to build your own solar generator. Remember you can scale up the wattage if you go with bigger batteries like (car batteries) and larger solar panels.,DIY,1536796174.0,150
Finally finished this big boy! What do you all think?,Warhammer,1536832687.0,34
Breanna Stewart leads Seattle Storm to WNBA championship in sweep!,SeattleWA,1536833181.0,35
Libtard Gets a taste of his own Sides SJW Retardation Over a Serena Argument,sjwhate,1536836970.0,57
"Roses are red, I fell in a pit",boottoobig,1536807046.0,111
My boss phat FIREd today. 45 years old. He couldn’t take any more of the corporate bullshit.,financialindependence,1536829779.0,210
Buzzfeed is soooooo original,WeWantPlates,1536789776.0,244
GOP campaigns took $7.35 million from oligarch linked to Russia | Commentary,The_Mueller,1536788191.0,345
My dad just texted me and said 'Found a rough draft of Trump's Rushmore addition' (OC) Hopewell Rocks NB,canada,1536867759.0,11
Dinner for the week. Chicken Soup. This is a greek chicken soup with rice and avgolemo sauce.,MealPrepSunday,1536825847.0,44
Poki Podcast on Twitch Con POGGERS,offlineTV,1536855142.0,14
Before + After Meditation,Meditation,1536805963.0,83
welcome back to,gamegrumps,1536815385.0,29
One of the most upvoted posts on the subreddit from 8 months ago. How times change...,KendrickLamar,1536820744.0,67
Vocês conhecem o Bumbasauro?,brasil,1536831248.0,27
Scathach &amp; Mashu,FGOcomics,1536844818.0,4
How I felt about today’s announcement,AppleWatch,1536818672.0,157
Middelbare school in Noord-Brabant voert blaastest in door stijging van dronken leerlingen in de les.,thenetherlands,1536858274.0,52
What the fuck,casualChildAbuse,1536814566.0,274
Let’s make this happen guys!,thanosdidnothingwrong,1536862538.0,16
“Please throw the ball” blop,blop,1536862844.0,2
Peterson for 2019,JordanPeterson,1536855909.0,10
Streamer with a bad attitude rage quits after losing to a teenage girl,FortNiteBR,1536817901.0,521
Amanita Muscaria,mycology,1536851165.0,23
What is all this EU stuff i keep seeing??,TooAfraidToAsk,1536822393.0,85
Arnold Schwarzenegger Rejected A Role In Shane Black's Upcoming 'The Predator' In Favor Of James Cameron's 'Terminator 6',movies,1536819564.0,427
"Richard Branson believes the key to success is a three-day workweek. With today's cutting-edge technology, he believes there is no reason people can't work less hours and be equally — if not more — effective.",Futurology,1536787218.0,4959
Mustang hits a bicyclist,bicycling,1536804084.0,108
"The XB-70 Valkyrie, the most beautiful weapon of mass destruction ever built",EngineeringPorn,1536806265.0,185
A friggin De-he-he-HEcent photo of the boys!...,trailerparkboys,1536841892.0,14
"Stopped at a Raleigh, NC supercharger as I drove away from Hurricane Florence's path and my charging was FREE in my Model III! Thanks Tesla!",teslamotors,1536823107.0,41
"My daughter was born with microtia, i.e she was born missing an ear. How do I convince my fiancé to stop playing video games and learn asl with me?",relationship_advice,1536833740.0,117
I made you all a GIF. Week 1 summarized.,GreenBayPackers,1536817399.0,35
Remember that time Black Cat Proposed to Spiderman,TwoBestFriendsPlay,1536835233.0,69
they wanted me to put it here too,SequelMemes,1536793380.0,77
BULLSHIT ALLERGY,GoodFakeTexts,1536810861.0,22
furry_irl,furry_irl,1536832043.0,32
TIL God Lisa su is recognized also on other subs. We shall addr/wallstreetbets to the list of approved subs,AyyMD,1536856150.0,10
Everyone wants to be an electrical conductor these days,NotKenM,1536857483.0,5
hmmm,hmmmgifs,1536836204.0,11
There will be blood.,bertstrips,1536808003.0,19
My sweet kitten is growing up so fast,Delightfullychubby,1536820647.0,12
This manual v10 monster is the most beautiful car that ever rolled in here.,Justrolledintotheshop,1536818956.0,79
"Ladies and gentlemen, please prepare for landing.",WhyWereTheyFilming,1536854148.0,25
Canadian // Chinese,MixedRaceGirls,1536861023.0,3
Lil nugget hanging out with his uncle.,mlem,1536799861.0,16
That one time Zachariah didn't lie.,Supernatural,1536857513.0,6
"If you haven't seen ""The Wailing"" yet on Netflix—do yourself a favor and just watch it.",horror,1536847994.0,50
Can we get a sticky for Nintendo Switch Online complaining for the next week or two?,NintendoSwitch,1536850743.0,120
"TIL according to Taika Waititi, 80% of the dialogue in Thor: Ragnarok was improvised, in order to create a ""very loose and collaborate mood"" among the cast an attempt to replicate the tone and sensibility from his previous films.",todayilearned,1536823619.0,876
Bill Skarsgard as Pennywise on IT: Chapter Two,Moviesinthemaking,1536858317.0,5
Keeping spiderbro safe,spiderbro,1536834795.0,27
Keeping spider bro safe,gifs,1536823044.0,1313
Hiked up Mt. Fuji to see the sunrise. [OC],japanpics,1536847267.0,3
This didn't happen to me but I still feel absolutely devastated. RIP,gamecollecting,1536834391.0,101
"[Chris Tomasson] I asked Vikings DT Sheldon Richardson if he has to be extra careful with roughing the passer w/refs protecting Aaron Rodgers on Sunday: “I play football. I’m not going to be dirty. I’m going to play football. It’s aggressive and it is what it is. If you’re scared, go to church.""",minnesotavikings,1536818671.0,44
"In honor of the death of David Foster Wallace, this is my favorite quote from his work",writing,1536802248.0,67
PSA: Check You Hype Levels,smashbros,1536816889.0,161
My sister caught her first Sailfish!,Fishing,1536785764.0,171
California tells NRA to stop selling insurance policy,gunpolitics,1536830277.0,29
A top Democrat is taking aim at a curious discrepancy between Trump's financial disclosure and what Michael Cohen and federal prosecutors laid out in his plea deal,RussiaLago,1536790642.0,31
"FACEBOOK GAVE APPLE, SAMSUNG AND OTHER FIRMS ‘DEEP ACCESS’ TO USER DATA, Now What?",privacy,1536858812.0,28
BULLSHIT ALLERGY,GoodFakeTexts,1536810861.0,22
Peterson for 2019,JordanPeterson,1536855909.0,10
Why Bush's quiet role in the financial crisis deserves attention now.,Economics,1536833702.0,36
Arnold Schwarzenegger Rejected A Role In Shane Black's Upcoming 'The Predator' In Favor Of James Cameron's 'Terminator 6',movies,1536819564.0,427
There will be blood.,bertstrips,1536808003.0,19
furry_irl,furry_irl,1536832043.0,32
This manual v10 monster is the most beautiful car that ever rolled in here.,Justrolledintotheshop,1536818956.0,79
I hate this so much,ComedyCemetery,1536801475.0,42
Lil nugget hanging out with his uncle.,mlem,1536799861.0,16
My sweet kitten is growing up so fast,Delightfullychubby,1536820647.0,12
hmmm,hmmmgifs,1536836204.0,11
TIL God Lisa su is recognized also on other subs. We shall addr/wallstreetbets to the list of approved subs,AyyMD,1536856150.0,10
"35,000 meters of chains decorate this restaurant in Shanghai, China [2636x1756]",RoomPorn,1536785757.0,77
Furry_irl,furry_irl,1536811756.0,77
Whole Foods Workers Revolt Against Amazon – Aim To Unionize After Awful Working Conditions,Anarchism,1536804449.0,57
"“However we play, today is our day. Happy #NationalVideoGamesDay” -Xbox",xboxone,1536799453.0,165
Canadian // Chinese,MixedRaceGirls,1536861023.0,3
Keeping spiderbro safe,spiderbro,1536834795.0,27
Hurricane Florence ain’t got time for them titties.,BlackPeopleTwitter,1536862344.0,19
Lil nugget hanging out with his uncle.,mlem,1536799861.0,16
"Deer Mountain, Alaska! Worth the 8 mile hike?",WildernessBackpacking,1536838121.0,10
How to have Jehovah's witnesses go away,notdisneyvacation,1536866849.0,6
Couldn’t even label the suitcase because it could be ANYTHING,dndmemes,1536837474.0,7
"M/29/6'0"" [150lbs to 175lbs] (3 years)",Brogress,1536832952.0,31
PsBattle: This old man with light up sneakers,photoshopbattles,1536803897.0,142
First ever computer... How did I do?,battlestations,1536822052.0,55
[blender] my first attempt! How did I do?,Simulated,1536810562.0,77
"“I can’t come tomorrow, I have to walk my friends.”",tall,1536846335.0,4
Mast Down,MetalMemes,1536836429.0,2
Exciting update! The Parkdale Pigeon has had babies!,melbourne,1536820725.0,58
Added another 250 watts of pv to our lives today. Two months into our homestead and we are getting more comfortable every day.,homestead,1536835278.0,32
Did you hear about the penis-less man who ejaculated ?,Jokes,1536805130.0,255
Not my problem,forhonor,1536849930.0,19
"[NO SPOILERS] I drew Arya Stark, ink on paper.",gameofthrones,1536789087.0,151
Remember the hummel figurine that catched Jimmy's eye in S4E2? Marie also stole a hummel figurine in Breaking Bad S4E3 in an open house during one of her kleptomaniac rushes,betterCallSaul,1536849946.0,33
Thats just sad,LeagueOfMemes,1536852116.0,9
Magic number: 10!!!,Braves,1536833127.0,104
(Never) Forget,worldpolitics,1536804079.0,185
good idea,MildlyVandalised,1536839240.0,2
National Aquarium's Naughty and Good 🐧🐧 of the month.,newzealand,1536808113.0,92
me_irl,COMPLETEANARCHY,1536808111.0,30
ZEEEEEEEROOOOO!,USMC,1536834792.0,69
"Im not european, but that is wack.",garlicoin,1536865969.0,2
A meme,weed,1536837574.0,8
Friendly Tigger.. No need to fear,BigCatGifs,1536811764.0,35
Smooby Cheese,smoobypost,1536804589.0,15
The easiest way to up your cooking is to get a meat thermometer.,Cooking,1536809215.0,205
"First time in the Outer Banks, NC. Caught this amazing sunset.",CampingandHiking,1536830746.0,22
Reddit shuts down r/greatawakening.,technology,1536813569.0,546
Report: Fournette likely to play this week,fantasyfootball,1536825792.0,217
hobbies include batch blending,starbucks,1536825998.0,28
Entarq's Citadel,ImaginaryLandscapes,1536820219.0,11
Official D&amp;D Survey,dndnext,1536808618.0,289
Nadal's favorite tea place,tennis,1536816637.0,52
Apple Watch Series 4 includes a bigger display and a built-in EKG scanner,gadgets,1536803667.0,710
24 years old dwelling in Florida. Life is good.,vandwellers,1536822670.0,86
Finally feel like I earned my own thumbs up,curlyhair,1536818325.0,26
"TIL the town of Rjukan, Norway receives no natural sunlight from September to March due to the steep mountains that surround it. They've installed 3 large mirrors to reflect light into the town's square. The mirrors track the sun's path and move every 10 secs to create a 600m squared pool of light.",todayilearned,1536785135.0,501
Finally decided on the name Ekatsim for my baby 💗 what do y'all think?,namenerds,1536850870.0,28
Hurricane Florence ain’t got time for them titties.,BlackPeopleTwitter,1536862344.0,19
"Neil deGrasse Tyson warns 'scientifically illiterate' electorate: the consequences of an “under-informed” electorate, noting that the “unraveling of an informed Democracy” occurs when those in power think “the wrong things about objective truths”.",EverythingScience,1536787630.0,252
iPhone SE and iPhone 6s no longer sold by Apple,apple,1536807635.0,470
I painted the gorge at Watkins Glen State Park today!,painting,1536832672.0,16
1000 upvotes and this sub will become an Apple-themed subreddit.,Gamingcirclejerk,1536803924.0,71
this sub right now,ethtrader,1536855323.0,8
Curious to see what the majority of this sub says,EDM,1536834430.0,67
First signs of Hurricane Florence starting to show up on radar.,TropicalWeather,1536810979.0,226
A friendly arm wrestling competition goes bad...,HadToHurt,1536814555.0,78
W OMEGALUL W,forsen,1536861984.0,8
This guy in Raleigh NC is selling dime bags of water.,facebookwins,1536863307.0,1
When multiple devs have worked on one project over the years,ProgrammerHumor,1536855845.0,13
"Everyone is all about Hurricane Florence, meanwhile category 5 Super Typhoon Mangkhut bares down on the Philippines",WeatherGifs,1536841643.0,24
Bitcoin Funny John McAfee,Bitcoin,1536818276.0,129
c͇̖͈͕̭̎ͤͧ̅u̜̱̖͆̎ͧ̄͐́r͏̣ͅs̜ͅe͓̖̊̃̽ͨ̒̈d̬ͤͤ̑̍̿͒ͯ_͖ͧ̂ͅc̝͔̤̰̖̅o͛̇̚҉̳̲s͈̟͕̰͔̱̺͆̍̚͞pͯ̉ͫ͛l̵̮͙̭̠̤ͪ̉ͬ̃ͤa̖̪͛̓ͤy͔͖̳̞͂̓͋̒̚͠,cursedcursedimages,1536831591.0,22
My friend saw this original GT40 at the Manhattan Classic Car Club!,Autos,1536833294.0,15
Can't wait,gorillaz,1536857600.0,4
My girlfriend said my shadow made me look like a dick head,mildlypenis,1536838880.0,12
You see comrade babushka always keeps with the new trends.,YouSeeComrade,1536791582.0,50
I love playing single parents the most,thesims,1536821815.0,30
Fog covered Toronto [OC] 1367x2048,CityPorn,1536864195.0,2
[WDYWT] I'm running out of Hawaiian shirts,streetwear,1536809967.0,70
Undersea Restaurant in the Maldives!,thalassophobia,1536787727.0,296
Bootlickers are the worst!,Bad_Cop_No_Donut,1536869302.0,4
Cleaning a DE pool filter,powerwashingporn,1536815952.0,77
First Time Render,blender,1536865810.0,5
The only review this dev has replied to in over 1 year.,ihadastroke,1536813718.0,10
"1 Year Ketoversary, 1st Physical Since Keto",keto,1536811449.0,189
"Hastur, The King in Yellow by me",Lovecraft,1536866638.0,3
How Apple has silently raised the price of their smartphones,apple,1536841127.0,308
This perfect Walmart purchase.,Perfectfit,1536839353.0,25
"Built the dining room around this rug brought over from my mom’s childhood home in Poland - Chicago, IL",AmateurRoomPorn,1536800686.0,80
We got our wedding cake topper in the mail yesterday. I'm sure Donut feels honored,pitbulls,1536791236.0,81
A local funeral home was giving away USB flash drives as an ad campaign,ATBGE,1536848117.0,29
Rooftop Combat,SpidermanPS4,1536820972.0,116
Holy God Mick! #dodgybox,ireland,1536858984.0,38
Super excited to join the ranks! All hail the empire!,EmpireDidNothingWrong,1536795597.0,52
"""How mankind ought to treat each other"" ~ Frederick Douglass [2046x1151]",QuotesPorn,1536818236.0,11
"Great Sand Dunes National Park, Colorado, USA",hiking,1536824025.0,16
A Boston Red Sox usher catches a foul ball with his bare hands. He takes his dues then makes a young fans night.,MadeMeSmile,1536856005.0,3
"Fritzi, the former mascot of an Afrika Korps unit, and adopted by the US Army Rangers.",wwiipics,1536842737.0,6
This guy weaving in a Freeway.,IdiotsInCars,1536800916.0,2101
Girezman on Instagram,LiverpoolFC,1536860501.0,56
[Pierce] Brandon McCarthy Will Finish Career with 69 Wins and a 4.20 ERA,baseball,1536840113.0,92
3D simulation of a man eating a shoe - 3186 views,DeepIntoYouTube,1536830740.0,35
Bad-ass poster,breakingbad,1536833489.0,9
Went from a toxic kitchen environment that offered no discounts on food to a wonderful kitchen that gives an daily shift meal. I’m genuinely happy to work at such a great new place. My first shift meal was phenomenal!,KitchenConfidential,1536813297.0,178
"Python developers locking conversations and deleting comments after people mass downvoted PRs to ""remove master/slave terminology from the language""",Python,1536861594.0,78
"If “The Onion” had existed since the dawn of time, what would some of their past headlines be?",AskReddit,1536857868.0,143
"Rooftopping in Austin, Texas",urbanexploration,1536809383.0,87
Türkiye'nin özeti (temsili..??),Turkey,1536850508.0,17
The federal gov. has handled Sandy worse than Katrina. There is no excuse why people don't have electricity or fuel yet. 1:11 PM - 6 Nov 2012,TrumpCriticizesTrump,1536787455.0,171
2me4me,2meirl4meirl,1536814370.0,49
Twitter blocks posts that use phrase 'illegal alien' as 'hateful content'.,Conservative,1536807761.0,238
Cookie cutter factory. With sound.,MachinePorn,1536858713.0,7
New billboard I just walked by.,southpark,1536801063.0,103
😂WHO😂DID😂THIS😂,comedyhomicide,1536845943.0,16
23 guidelines for writing readable code,programming,1536842837.0,158
Bolibompa DAWken,unket,1536848250.0,3
Somone uploaded a bad photo of me on FB now I feel like a thumb and need reassurance from strangers on the internet,gaybrosgonemild,1536860548.0,22
"Less than $1,000 to go 'til my emergency fund is ready. Last lap.",Frugal,1536812211.0,324
Dog transformation,RedditInReddit,1536812560.0,15
"Tom Telesco (chargers General Manager) was originally hired by the panthers to only assist with training camp in 1995. Once training camp was over, his plan was to keep showing up everyday until someone told him otherwise. His plan worked and he stayed on as an assistant.",ActLikeYouBelong,1536809614.0,17
"cricket James Anderson column: Glenn McGrath was better than me, Dale Steyn is too",Cricket,1536850341.0,70
Momma fox welcomes orphaned bears,AnimalsBeingMoms,1536863783.0,4
How to use a rubber ball to switch your gender and race.,disneyvacation,1536838902.0,15
Literal trash panda,trashpandas,1536821442.0,5
meirl,meirl,1536798686.0,54
The best defense against oneitis is to learn how to love women. Appropriately.,TheRedPill,1536838986.0,57
F,CowChop,1536835795.0,33
Freaky Florence,marvelmemes,1536826102.0,3
What have I created,magicthecirclejerking,1536848207.0,15
First bite was not a disappointment. Really pleased with how light and fluffy these donuts turned out and even though it’s not “bread” I’m proud of how shiny the glaze turned out too.,Breadit,1536815462.0,40
Half a circle away from eyeglasses,awfuleyebrows,1536861460.0,4
If it ain’t white it ain’t right,OffensiveMemes,1536817068.0,25
The Patch Note Graph nobody asked for,btd6,1536865250.0,12
