title,subreddit,created,num_comments
who hasn't had crushes on their teachers.,SuddenlyGay,1536815849.0,156
"TIL according to Taika Waititi, 80% of the dialogue in Thor: Ragnarok was improvised, in order to create a ""very loose and collaborate mood"" among the cast an attempt to replicate the tone and sensibility from his previous films.",todayilearned,1536823619.0,820
I just got one upped,Tinder,1536820787.0,241
Little bit different as I was the potential buyer......but somehow he still turned into a choosing beggar?¿,ChoosingBeggars,1536830099.0,822
"If a genie grants you the opportunity to ejaculate $50 in cash instead of sperm every time you cum for the rest of your life meaning you can't have any more children, would you accept? Why, why not?",AskReddit,1536814042.0,10516
"Apartment maintenance man saw me in a state of undress, put his finger in my mouth.",legaladvice,1536822507.0,300
The truth,funny,1536857188.0,388
Reddît Bans Qanon Subreddits After Series of Violent Threats,news,1536823884.0,3218
"My brother didn't make it to the bedside before my father died, but I lied to him so he'd think he did",confessions,1536811474.0,61
Every time,BlackPeopleTwitter,1536837714.0,88
Sebastian Vettel stops 2015 celebrations to get Kimi Raikkonen's name added to pitboard 👏🏻,formula1,1536844103.0,184
HyunA and E'Dawn to leave CUBE Entertainment,kpop,1536835403.0,1221
Local vineyard forced to shut down as nearly entire season's harvest is stolen in one night.,iamatotalpieceofshit,1536816593.0,259
"In a twist that no one saw coming, LAOP was fired for being so offensive to a woman that his company was banned from a hotel",bestoflegaladvice,1536834178.0,535
"What were /r/MillionDollarExtreme, /r/BillionShekelSupreme, and /r/GreatAwakening, and why were they banned?",OutOfTheLoop,1536816179.0,733
Every morning on my way to work I am greeted by this handsome man. His name is Mr Gavin,aww,1536856135.0,335
"President Trump has promised for years that Mexico would pay for a vast border wall. Now, in the Trump administration’s campaign to stop illegal immigration, the United States plans instead to pay Mexico $20 million in foreign assistance funds to deport as many as 17,000 people.",worldnews,1536834382.0,1898
What is one thing you hate about being a man in today's society?,AskMen,1536812291.0,2269
My MacBook Air won’t connect to my schools Wifi?,Ooer,1536787535.0,175
First ever Iron Man poster from 2006 comic con.,marvelstudios,1536814505.0,358
Petition for Jordan Kimball to replace Colton Underwood as season 23 bachelor.,thebachelor,1536839670.0,91
r/GreatAwakening has been BANNED,TopMindsOfReddit,1536806340.0,5739
"This guy: Someone I ""love"" tried to commit suicide but let's make it all about me.",insanepeoplefacebook,1536827428.0,426
2meirl4meirl,2meirl4meirl,1536828377.0,198
My sad github repo.,ProgrammerHumor,1536849487.0,124
The story of this post is that it's a meme,PandR,1536842499.0,63
who hasn't had crushes on their teachers.,SuddenlyGay,1536815849.0,156
Protecting your Girlfriend from Spiders in Australia,Unexpected,1536841076.0,220
“Go pick on someone your size!”,BlackPeopleTwitter,1536786434.0,97
When the middle class blames problems on the poor,LateStageCapitalism,1536845358.0,113
Owing money for investment llc,legaladvice,1536814089.0,11
I just got one upped,Tinder,1536820787.0,241
"If a genie grants you the opportunity to ejaculate $50 in cash instead of sperm every time you cum for the rest of your life meaning you can't have any more children, would you accept? Why, why not?",AskReddit,1536814042.0,10517
"Sob stories, army, screenshots and TV shows, everybody!",quityourbullshit,1536837447.0,340
"Apartment maintenance man saw me in a state of undress, put his finger in my mouth.",legaladvice,1536822507.0,300
"TIL according to Taika Waititi, 80% of the dialogue in Thor: Ragnarok was improvised, in order to create a ""very loose and collaborate mood"" among the cast an attempt to replicate the tone and sensibility from his previous films.",todayilearned,1536823619.0,820
What is a good sign a couple will be together for quite awhile?,AskReddit,1536787586.0,727
Killed a snake that entered apartment. Neighbor is saying it is his snake. Apartment is saying killing it was illegal in Arkansas.,legaladvice,1536794732.0,133
For the last couple months my 8yr old has consistently asked me to submit this suggestion to Fortnite developers. So... There you go,FortNiteBR,1536840476.0,647
What is one thing you hate about being a man in today's society?,AskMen,1536812291.0,2269
[Image] Never Give Up,GetMotivated,1536835872.0,461
"What were /r/MillionDollarExtreme, /r/BillionShekelSupreme, and /r/GreatAwakening, and why were they banned?",OutOfTheLoop,1536816179.0,733
Those red pebbled cups from the pizza joint with the arcade when you were a kid.,nostalgia,1536834141.0,450
Tesla workers speak out: 'Anything pro-union is shut down really fast',news,1536785037.0,6251
"Monument Valley, Utah [2048x2560][OC]",EarthPorn,1536833293.0,304
"Roommate fucked up BIG, how can those of us left protect ourselves?",legaladvice,1536803045.0,99
"In a twist that no one saw coming, LAOP was fired for being so offensive to a woman that his company was banned from a hotel",bestoflegaladvice,1536834178.0,535
Watermelon thief,bigboye,1536789804.0,128
What was that?!,StartledCats,1536835884.0,154
"President Trump has promised for years that Mexico would pay for a vast border wall. Now, in the Trump administration’s campaign to stop illegal immigration, the United States plans instead to pay Mexico $20 million in foreign assistance funds to deport as many as 17,000 people.",worldnews,1536834382.0,1898
Good Guy Warrick Dunn,HumansBeingBros,1536845673.0,63
Sebastian Vettel stops 2015 celebrations to get Kimi Raikkonen's name added to pitboard 👏🏻,formula1,1536844103.0,184
Saw this gem on my hometowns Facebook group.,oldpeoplefacebook,1536834620.0,180
Disturbing,bonehurtingjuice,1536846745.0,52
This black car looks like a mirror after being washed.,mildlyinteresting,1536832880.0,2039
"Manhattan DA's office drops more than 3,000 open marijuana cases",news,1536829557.0,485
I invented a new golf ball that’ll automatically go in the hole if it gets within four inches.,Jokes,1536838521.0,192
This poor child...,DiWHY,1536836392.0,476
Usain bolt races in reduced gravity,gifs,1536827951.0,1716
Amethyst Geode Agate carved skull,interestingasfuck,1536833320.0,95
Little bit different as I was the potential buyer......but somehow he still turned into a choosing beggar?¿,ChoosingBeggars,1536830099.0,822
We need a reality show where flat-earthers attempt to find the edge of the planet.,Showerthoughts,1536843427.0,214
The scene in Reno 911 where they all think they won the lottery never gets old,videos,1536828760.0,1027
"First image from James Gray's sci-fi epic ""Ad Astra"" staring Brad Pitt and Tommy Lee Jones",movies,1536831159.0,542
I compared 100 years of hurricane paths vs. Georgia animated by /u/Tjukanov [OC]-ish,dataisbeautiful,1536831013.0,464
Every time,BlackPeopleTwitter,1536837714.0,88
"TIL of Audie Murphy who was awarded every military combat award for valor available from the U.S. Army, as well as French and Belgian awards for heroism.",todayilearned,1536827322.0,1270
LPT: Just a reminder for everyone affected by Hurricane Florence to shoot it. The force of the bullet will push it away and prevent any damage.,ShittyLifeProTips,1536836240.0,141
Really Real,WhitePeopleTwitter,1536830912.0,342
Never saw it coming,woooosh,1536844179.0,56
long enough title,memes,1536857609.0,58
ELI5: Why do hurricanes hit the U.S. East Coast so often but never on the West Coast?,explainlikeimfive,1536846199.0,333
MRW someone calls me an adequate giffer,HighQualityGifs,1536837283.0,38
2meirl4meirl,2meirl4meirl,1536828377.0,199
a swift justice for phone thief,JusticeServed,1536833559.0,143
Goodnight Mama Su 🌃,wallstreetbets,1536828953.0,383
TooMeIrlForMeIrl,TooMeIrlForMeIrl,1536854054.0,27
Is that you in the middle of the street?,DeepFriedMemes,1536831050.0,60
"North Korea censors the internet and all outside media, (1997)",fakehistoryporn,1536830376.0,131
This may not be a big deal but i really wish that checking the battery on your Dualshock 4 showed you a % instead of just 3 bars,PS4,1536831320.0,269
hmmm,hmmm,1536826152.0,246
not even H20 will stop this absolute madlad,madlads,1536843726.0,33
Poland says it will block any EU sanctions against Hungary,europe,1536850128.0,963
What profit does this bring in for anyone?😂,BikiniBottomTwitter,1536829407.0,99
RIP Bing.,sadcringe,1536836834.0,179
"Thot destroyer. Upvote this image, so it will show up when you google ""Thot destroyer"".",HistoryMemes,1536856052.0,20
"Landscape otter by David Poe at Moon Tattoo (Austin, TX)",tattoos,1536832655.0,55
"This guy: Someone I ""love"" tried to commit suicide but let's make it all about me.",insanepeoplefacebook,1536827428.0,426
"""So you have to make bootleg memes in the EU?""",PrequelMemes,1536823838.0,237
anime_irl,anime_irl,1536829199.0,214
It’s spring time in Canberra. This guy saw me and held on for a solid 500m waiting to pluck my eyeballs out,australia,1536851496.0,90
WCGW if I overtake this biker while talking on the phone?,Whatcouldgowrong,1536823058.0,939
Got that hole patched!,NotMyJob,1536828760.0,134
To Compete Against Google,therewasanattempt,1536822800.0,517
Go back to school guys,facepalm,1536838313.0,138
Having to ring the doctors 100 times at 8am because they don't have a queueing system,britishproblems,1536851146.0,154
My mom just won a local cake competition. So proud!,Damnthatsinteresting,1536820484.0,812
"Good morning, Bristol!",CasualUK,1536854596.0,94
Hold that thought,inthesoulstone,1536823150.0,130
"Schachmatt, Axel Voss",de,1536855808.0,62
One Piece: Chapter 917,OnePiece,1536847708.0,922
"AHS | S08E01 ""The End"" [Season Premiere Discussion Thread]",AmericanHorrorStory,1536830912.0,3149
"Monument Valley, Utah [2048x2560][OC]",EarthPorn,1536833293.0,304
This one had me giggling. No credit taken.,puns,1536854113.0,22
Don't you just love racist incels,IncelTears,1536842338.0,80
Passive Guy Who Isn’t Really Happy starter pack,starterpacks,1536795207.0,1733
The Raise hell mural today,AFL,1536837332.0,49
[WP] Dwight Schrute tries to get the Pawnee Parks Department paper account and he has to sell to Ron Swanson,WritingPrompts,1536788952.0,322
Map showing which U.S states have the most Presidents.,MapPorn,1536838708.0,296
"Scientists discover optimal magnetic fields for suppressing instabilities in tokamak fusion plasmas, to potentially create a virtually inexhaustible supply of power to generate electricity in what may be called a “star in a jar,” as reported in Nature Physics.",science,1536791529.0,1331
Twitter loves bullying,PublicFreakout,1536803635.0,734
"TIFU by drilling my 6 year old in the face, Hail Mary style.",tifu,1536860314.0,80
How to dress for your first day at a legally-safe-knockoff of Hot Topic,disneyvacation,1536828491.0,72
Got that hole patched!,NotMyJob,1536828760.0,134
"Oh no, he blocked me :(",creepyPMs,1536846174.0,92
THIS MAD LAD,madlads,1536844223.0,59
Disturbing,bonehurtingjuice,1536846745.0,52
"I shot a beautiful wedding last month, and upon seeing this image, these two knockouts said ""We look like kings!""",lgbt,1536798836.0,616
Is that you in the middle of the street?,DeepFriedMemes,1536831050.0,60
a swift justice for phone thief,JusticeServed,1536833559.0,143
RIP Bing.,sadcringe,1536836834.0,179
"Last week I handed in my notice, yesterday 1/3 of IT got walked out the door.",sysadmin,1536863325.0,64
"My daughter was born with microtia, i.e she was born missing an ear. How do I convince my fiancé to stop playing video games and learn asl with me?",relationship_advice,1536833740.0,92
Tennessee will provide free tickets to Hurricane Florence evacuees from North and South Carolina for Saturday’s home game w/UTEP,CFB,1536814921.0,289
Petition for Jordan Kimball to replace Colton Underwood as season 23 bachelor.,thebachelor,1536839670.0,91
who hasn't had crushes on their teachers.,SuddenlyGay,1536815849.0,156
"Article 13 memes are about to be hot, get ready to profit!!",MemeEconomy,1536817828.0,2443
[Homemade] Hand-painted Macarons,food,1536857477.0,16
"Just moved my room around, and turns out my mattress is a nice height for this PowerPoint",Perfectfit,1536845098.0,138
The rare sharkhog mating dance,AnimalsBeingDerps,1536816298.0,160
Who’s a good boy?,Eyebleach,1536823559.0,98
Amen,terriblefacebookmemes,1536840140.0,110
Thief prank,nonononoyes,1536828737.0,181
Map showing which U.S states have the most Presidents.,MapPorn,1536838708.0,296
mangoman51 describes the real impact of a recent discovery about tokamak fusion plasmas,bestof,1536832068.0,130
How did dinosaurs have sex?,askscience,1536858235.0,122
Karen Gillan posted this on her instagram story,marvelstudios,1536828299.0,147
How to dress for your first day at a legally-safe-knockoff of Hot Topic,disneyvacation,1536828491.0,72
The Bearded Fireworm looks like something out of a horror movie,natureismetal,1536814030.0,777
This is my signature “KBound” face. My friends seem to think I wear it a bit better now. Although now they call it the “MBound” face 😂 (my new name is Megan). This past year of transitioning and figuring myself out has been a blast! (Trans Girl - 1yr hormones.),happy,1536832989.0,160
Giving his buddy a massage,AnimalsBeingBros,1536813891.0,165
Daily Cardio rain or shine,likeus,1536821687.0,50
PsBattle: Goats on a rock,photoshopbattles,1536816037.0,135
The wrath of the stoner art student,ProRevenge,1536854036.0,60
"ULPT: If you're called out for spending too long in the shower, say it's because you have a high standard of personal hygiene. It implies they don't wash themselves properly and should shame them into silence.",UnethicalLifeProTips,1536864137.0,27
I hate it too yay,FunnyandSad,1536851015.0,21
This is amazing,TheLastAirbender,1536815923.0,124
This does put a smile on my face.,thanosdidnothingwrong,1536817024.0,167
There's too many people on this earth. We need a new plague.,DunderMifflin,1536814007.0,951
cApYBaRa SoUP mAdE FRoM LivE aNiMALs!,PeopleFuckingDying,1536817994.0,75
"The vase i printed using the tips yesterday ended up perfect. No burrs, strings, or marks visible. Huge thank you to the community.",3Dprinting,1536821543.0,165
Nailed it,yesyesyesyesno,1536832744.0,53
"My bank is refusing to return £1,400 of unauthorised payments. I go to Uni in 7 days. What do I do?",personalfinance,1536853575.0,103
Pulling up behind a sewage truck,Wellthatsucks,1536812936.0,489
Tyrion and Jon arrive to White Harbor,freefolk,1536833306.0,19
This is the best one I’ve seen yet don’t be a hypocrite,MurderedByWords,1536860400.0,56
Can you feel the love?,xboxone,1536859096.0,61
A brilliant tuned mass damper demonstration with simple paper,educationalgifs,1536812501.0,143
return,comics,1536816562.0,60
Meet Minnie and her teefies,teefies,1536828709.0,17
Parenting done correctly.,gaming,1536862412.0,62
[Legit] Incense,BoneAppleTea,1536821441.0,95
Get outta here with your soft hands,iamverybadass,1536845495.0,88
"LPT: If you make a mistake, admit to the mistake, apologize, and explain what steps you'll take to prevent it from happening again in the future. It's very hard for people to yell at you if you've done that.",LifeProTips,1536811584.0,1142
ITAP of an art exhibit in Tokyo,itookapicture,1536822438.0,36
Well.. there it is.,ofcoursethatsathing,1536847403.0,26
What do you mean you wanted to have fun?,webcomics,1536858496.0,8
"A remarkable habit of the Asian house shrew is that it forms a ”caravan” with its young, that is, the young line up behind the mother and follow it while she walks",Awwducational,1536855121.0,20
I made Bender a few years back. Complete with working chest door!,futurama,1536859341.0,16
Science,technicallythetruth,1536822172.0,25
Me_irl,meirl,1536847305.0,8
Thief prank,instantkarma,1536854509.0,34
Naomi Osaka is reportedly set to sign Adidas' biggest deal with a female athlete — and it could make her one of the highest-paid women in sports,sports,1536809196.0,2815
The goodest hospital volunteer,dogswithjobs,1536815087.0,74
One thing that was super important to us while we were making our game (Verlet Swing) was having super tight hitboxes so our players could find little cracks to squeeze through. Here's one instance of those cracks.,HitBoxPorn,1536833186.0,242
Water Temple by Tom Garden,zelda,1536821548.0,69
He saw a chance and he took it,BetterEveryLoop,1536810817.0,194
Impressing a Princess,youseeingthisshit,1536813763.0,86
"Sleeping Cat. Ivory, 19th century, Japan [2100x1600]",ArtefactPorn,1536856743.0,10
"Not only will Tesla’s next gen car cook your breakfast, it will also quickly &amp; painfully teleport you to your destination.",wheredidthesodago,1536810577.0,134
Ive got my eyes on you,evilbuildings,1536819795.0,48
Terry Crews just took a selfie with Big Bird,CrewsCrew,1536810599.0,153
HMJB while I launch my brother over the fence,holdmyjuicebox,1536854204.0,10
You must wash yourself in the blood,PoliticalHumor,1536811665.0,1153
Why walk when you can _____?,AskOuija,1536835011.0,162
Everyday after school I’m greeted by this delight,MasterReturns,1536819760.0,28
“This never would’ve happened if you didn’t make me hit you!!!!”,Nicegirls,1536818614.0,182
Hiding out in our farm’s greenhouse during a rainstorm,raining,1536825306.0,53
When you realize r/CringeAnarchy is being flooded with refugees from recently banned subs,CringeAnarchy,1536860887.0,42
What electrical engineers listen to on study breaks,EngineeringStudents,1536848054.0,30
ETH vs. Apple products,CryptoCurrency,1536860044.0,39
The Saizo,FireEmblemHeroes,1536824997.0,133
New Chinese Exclusive Chibi Figures,BokuNoHeroAcademia,1536849599.0,30
Six door Prius,ATBGE,1536809034.0,372
WhatsApp please.,softwaregore,1536858428.0,28
Microsoft's Video Game Day Tweet celebrates unity amongst platforms.,NintendoSwitch,1536831678.0,158
Streets of San Francisco,pics,1536837659.0,272
"I made a seven layer, eight pound lasagne with homemade pasta, bolognese, bechamel, ricotta and spinach. Timelapse of the build in the comments.",FoodPorn,1536827295.0,81
"Teachout: As Attorney General, I will sue Trump, investigate corruption in Albany, break up corporate monopolies &amp; lead the fight to end mass incarceration. I'm a former death penalty defense lawyer, ready for hard high-stakes fights, and an anticorruption expert. I hope I earn your vote. (NY-AG)",BlueMidterm2018,1536811373.0,234
NBA 2K19 Is A Pay-To-Win Sham (And They Just Nerfed XP Gains),pcgaming,1536837702.0,219
"A lot of you liked the Bojack piece I posted a few months ago, finished this today in anticipation of the new season!",BoJackHorseman,1536821145.0,79
These two pens at my office.... Nothing can possibly go wrong,mildlyinfuriating,1536807960.0,196
Chunky floof zooms,Zoomies,1536822326.0,21
Lockheed F-117 Nighthawk Davis Monthan Air Force Base,aviation,1536845971.0,28
Idag i Metro,sweden,1536852932.0,14
One final chance to set thing right,StarWars,1536811988.0,655
A little t shirt design I made,outrun,1536815147.0,142
The adoration of St. George,AccidentalRenaissance,1536810743.0,102
2019 Ferrari 488 Pista dressed in blue,carporn,1536825457.0,38
"Day at the Arcade, Digital, 1600x1600",Art,1536809429.0,309
Rip,drunk,1536812458.0,88
Penis,ComedyCemetery,1536812605.0,220
Fixing her arm...,Cyberpunk,1536829881.0,40
"If a genie grants you the opportunity to ejaculate $50 in cash instead of sperm every time you cum for the rest of your life meaning you can't have any more children, would you accept? Why, why not?",AskReddit,1536814042.0,10518
Water physics,blackmagicfuckery,1536814080.0,73
Good times gone bad,trippinthroughtime,1536823113.0,11
Made this in school as a pop art project :),PUBATTLEGROUNDS,1536834425.0,70
Got love for the bees too!,wholesomebpt,1536810081.0,113
This guy adopted us a year ago...he still thinks he needs an invitation to come into the house.,aww,1536828833.0,344
The Greater Good?!,Breath_of_the_Wild,1536821812.0,118
While I train for the zombie apocalypse,holdmyredbull,1536837869.0,72
My third shift buddy. She adjusted to my new work schedule better than I thought she would.,corgi,1536808779.0,52
HMB while I kill brain cells,holdmybeer,1536845912.0,49
Bitcoin vs Septim,ElderScrolls,1536862334.0,31
Just found this fun little set @ Target! Can't find any mention of it anywhere...,lego,1536830401.0,101
Are we just gonna keep pretending like in our first introduction to Turk he wasn't about to sell a bunch of women into a lifetime of sex slavery?,Defenders,1536809684.0,113
US threatens to arrest ICC judges if they pursue Americans for Afghan war crimes,worldnews,1536810454.0,1049
2meirl4meirl,2meirl4meirl,1536791303.0,179
Does anyone else say it along with them?,brooklynninenine,1536816897.0,68
While I train for the zombie apocalypse,holdmyredbull,1536837869.0,72
"Lots of women often complain that men are bad at noticing flirting, but maybe those women just aren't that good at flirting noticeably",Showerthoughts,1536814236.0,183
The elusive mudderfly.,WhatsWrongWithYourDog,1536805515.0,305
Wikipedia Leads Effort to Create a Digital Archive of 20 Million Artifacts Lost in the Brazilian Museum Fire,history,1536807821.0,76
HMB while I kill brain cells,holdmybeer,1536845912.0,49
Idiocy is a disease,BlackPeopleTwitter,1536801499.0,95
Decided to clean up the tomatoes today and someone decided she needed a little snack.,gardening,1536815405.0,117
My boss phat FIREd today. 45 years old. He couldn’t take any more of the corporate bullshit.,financialindependence,1536829779.0,187
That's some neat space saving design.,DesignPorn,1536830812.0,84
Nintendo Direct - 09.13.2018,smashbros,1536789417.0,991
[1101x614] The Edouard Bohlen 1907 located on the Skeleton Coast Namibia 🇳🇦 The desert sands began to overtake the beach and caused a dramatic shift to the coastline. It is grounded 500meters/1640ft from the ocean.,AbandonedPorn,1536842406.0,18
I’m NASA astronaut Scott Tingle. Ask me anything about adjusting to being back on Earth after my first spaceflight!,IAmA,1536806657.0,745
"This popped up on my Facebook feed, and it gave me a chuckle",Military,1536822822.0,38
Bitcoin vs Septim,ElderScrolls,1536862334.0,31
This birb,PartyParrot,1536845555.0,6
My wonderful friend drew this for our mutual friend that had lost one of her dogs. Wanted to give him and the good boy Monty some love.,drawing,1536826191.0,33
One Piece: Chapter 917,OnePiece,1536847708.0,922
Vitamin Candles,antiMLM,1536823907.0,42
I ran a totally illegal investment business. WCGW? Oh really? Prison? Shit.,bestoflegaladvice,1536817542.0,237
Thursday! Hope this is worthy. Green Sharpie on a PostIt.,PenmanshipPorn,1536821079.0,50
Nice Speakers,indianpeoplefacebook,1536839588.0,24
Decided to clean up the tomatoes today and someone decided she needed a little snack.,gardening,1536815405.0,118
Begone,youdontsurf,1536854063.0,7
The elusive mudderfly.,WhatsWrongWithYourDog,1536805515.0,305
This is a Garlic Bread Made with 1600 Characters,GarlicBreadMemes,1536832972.0,31
I like the way he thinks,vegan,1536831170.0,64
"This popped up on my Facebook feed, and it gave me a chuckle",Military,1536822822.0,38
One dog has ear medicine she needs and the other one also thinks he needs it too,MadeMeSmile,1536828420.0,29
It still lives!?,2healthbars,1536835959.0,24
My wonderful friend drew this for our mutual friend that had lost one of her dogs. Wanted to give him and the good boy Monty some love.,drawing,1536826191.0,37
Spheribowl,Superbowl,1536859549.0,6
"Jax, sweetheart and terror all in one kitten",curledfeetsies,1536828455.0,32
HMC While I jump on this trampoline.,holdmycosmo,1536852443.0,6
r/GreatAwakening has been BANNED,TopMindsOfReddit,1536806340.0,5753
Extra crispy,PublicFreakout,1536832597.0,108
Local vineyard forced to shut down as nearly entire season's harvest is stolen in one night.,iamatotalpieceofshit,1536816593.0,275
Thursday! Hope this is worthy. Green Sharpie on a PostIt.,PenmanshipPorn,1536821079.0,50
QUINTESSENTIAL,funhaus,1536840036.0,18
And the lightning to 3.5mm adapter is no longer included.,apple,1536807070.0,2592
"Nintendo Co., Ltd. apply for new Golden Sun videogame trademark",nintendo,1536858938.0,47
Yee,shittyrainbow6,1536859712.0,8
Video of the bong my partner and I have been working on for 4 years (follow up to image posted earlier),StonerEngineering,1536826888.0,105
"[OC] Only 100% legit guild contracts here... Definitely no Orc traps, no sir!",DnD,1536815779.0,130
hey hooman i want treats,noisygifs,1536861627.0,11
Last one,Memes_Of_The_Dank,1536855227.0,9
MRW an expensive car isn’t slowing down as I cross the street and I’m a broke college student,reactiongifs,1536802596.0,205
"Scientists discover optimal magnetic fields for suppressing instabilities in tokamak fusion plasmas, to potentially create a virtually inexhaustible supply of power to generate electricity in what may be called a “star in a jar,” as reported in Nature Physics.",science,1536791529.0,1341
"We stand united, to defend the EU",lotrmemes,1536844913.0,90
My friend is an elementary school teacher,KidsAreFuckingStupid,1536803550.0,238
"Google is discontinuing Inbox, focusing on Gmail",Android,1536804492.0,1715
"Thot destroyer. Upvote this image, so it will show up when you google ""Thot destroyer"".",HistoryMemes,1536856052.0,35
Got that hole patched!,NotMyJob,1536828760.0,134
"Not only will Tesla’s next gen car cook your breakfast, it will also quickly &amp; painfully teleport you to your destination.",wheredidthesodago,1536810577.0,136
That's some neat space saving design.,DesignPorn,1536830812.0,89
[Maryland] Employee is threatening to file a lawsuit against me for fostering a hostile work environment?,legaladvice,1536807702.0,165
